-- phpMyAdmin SQL Dump
-- version 5.2.2
-- https://www.phpmyadmin.net/
--
-- Host: 127.0.0.1:3306
-- Generation Time: Jan 30, 2026 at 05:28 PM
-- Server version: 11.8.3-MariaDB-log
-- PHP Version: 7.2.34

SET SQL_MODE = "NO_AUTO_VALUE_ON_ZERO";
START TRANSACTION;
SET time_zone = "+00:00";


/*!40101 SET @OLD_CHARACTER_SET_CLIENT=@@CHARACTER_SET_CLIENT */;
/*!40101 SET @OLD_CHARACTER_SET_RESULTS=@@CHARACTER_SET_RESULTS */;
/*!40101 SET @OLD_COLLATION_CONNECTION=@@COLLATION_CONNECTION */;
/*!40101 SET NAMES utf8mb4 */;

--
-- Database: `u298285424_db_pemuda`
--

-- --------------------------------------------------------

--
-- Table structure for table `bukti_transfer`
--

CREATE TABLE `bukti_transfer` (
  `id_bukti_transfer` int(11) NOT NULL,
  `id_dojang` int(11) NOT NULL,
  `id_pelatih` int(11) NOT NULL,
  `bukti_transfer_path` varchar(255) NOT NULL,
  `created_at` datetime(3) NOT NULL DEFAULT current_timestamp(3)
) ENGINE=InnoDB DEFAULT CHARSET=utf8mb4 COLLATE=utf8mb4_unicode_ci;

--
-- Dumping data for table `bukti_transfer`
--

INSERT INTO `bukti_transfer` (`id_bukti_transfer`, `id_dojang`, `id_pelatih`, `bukti_transfer_path`, `created_at`) VALUES
(15, 1, 1, '1_dojang-1_bukti_3_28-09-2025_23.08.png', '2025-09-28 16:08:55.959'),
(16, 18, 21, '21_dojang-18_bukti_1_29-09-2025_20.29.jpeg', '2025-09-29 13:29:59.572'),
(17, 12, 14, '14_dojang-12_bukti_1_30-09-2025_08.13.jpg', '2025-09-30 01:13:11.213'),
(18, 40, 42, '42_dojang-40_bukti_1_30-09-2025_12.53.jpeg', '2025-09-30 05:53:49.380'),
(19, 25, 28, '28_dojang-25_bukti_1_01-10-2025_05.55.jpeg', '2025-09-30 22:55:49.163'),
(20, 20, 70, '70_dojang-20_bukti_1_01-10-2025_09.45.jpg', '2025-10-01 02:45:50.578'),
(21, 20, 70, '70_dojang-20_bukti_2_01-10-2025_09.46.jpg', '2025-10-01 02:46:22.465'),
(22, 35, 40, '40_dojang-35_bukti_1_01-10-2025_18.39.jpg', '2025-10-01 11:39:48.093'),
(23, 70, 77, '77_dojang-70_bukti_1_04-10-2025_20.57.jpg', '2025-10-04 13:57:59.536'),
(24, 44, 50, '50_dojang-44_bukti_1_05-10-2025_19.28.jpeg', '2025-10-05 12:28:09.501'),
(25, 76, 85, '85_dojang-76_bukti_1_06-10-2025_22.50.jpg', '2025-10-06 15:50:13.147'),
(26, 76, 85, '85_dojang-76_bukti_2_06-10-2025_22.50.jpg', '2025-10-06 15:50:48.702'),
(27, 76, 85, '85_dojang-76_bukti_3_06-10-2025_22.55.jpg', '2025-10-06 15:55:22.677'),
(28, 76, 85, '85_dojang-76_bukti_4_06-10-2025_22.55.jpg', '2025-10-06 15:55:34.244'),
(29, 76, 85, '85_dojang-76_bukti_5_06-10-2025_22.55.jpg', '2025-10-06 15:55:47.794'),
(30, 86, 92, '92_dojang-86_bukti_1_08-10-2025_13.38.jpg', '2025-10-08 06:38:16.156'),
(31, 86, 92, '92_dojang-86_bukti_2_08-10-2025_13.39.jpg', '2025-10-08 06:39:02.394'),
(32, 88, 94, '94_dojang-88_bukti_1_11-10-2025_20.22.jpeg', '2025-10-11 13:22:48.889'),
(33, 21, 25, '25_dojang-21_bukti_1_11-10-2025_22.17.jpg', '2025-10-11 15:17:23.296'),
(34, 31, 84, '84_dojang-31_bukti_1_12-10-2025_08.54.jpg', '2025-10-12 01:54:58.646'),
(35, 99, 109, '109_dojang-99_bukti_1_15-10-2025_20.05.jpg', '2025-10-15 13:05:19.734'),
(36, 99, 109, '109_dojang-99_bukti_2_15-10-2025_20.08.jpg', '2025-10-15 13:08:15.000'),
(37, 14, 16, '16_dojang-14_bukti_1_16-10-2025_09.28.jpg', '2025-10-16 02:28:47.847'),
(38, 81, 88, '88_dojang-81_bukti_1_19-10-2025_15.13.jpeg', '2025-10-19 08:13:32.416'),
(40, 62, 67, '67_dojang-62_bukti_1_25-10-2025_12.43.jpeg', '2025-10-25 05:43:25.333'),
(42, 112, 131, '131_dojang-112_bukti_1_26-10-2025_20.09.jpg', '2025-10-26 13:09:33.564'),
(43, 48, 82, '82_dojang-48_bukti_1_26-10-2025_20.46.jpg', '2025-10-26 13:46:07.564'),
(44, 39, 41, '41_dojang-39_bukti_1_26-10-2025_21.21.jpg', '2025-10-26 14:21:14.108'),
(45, 30, 32, '32_dojang-30_bukti_1_27-10-2025_22.31.jpg', '2025-10-27 15:31:07.218'),
(46, 98, 108, '108_dojang-98_bukti_1_29-10-2025_09.22.png', '2025-10-29 02:22:56.847'),
(47, 9, 10, '10_dojang-9_bukti_1_31-10-2025_17.21.jpg', '2025-10-31 10:21:55.029'),
(48, 9, 10, '10_dojang-9_bukti_2_31-10-2025_17.22.jpg', '2025-10-31 10:22:20.626'),
(49, 16, 18, '18_dojang-16_bukti_2_31-10-2025_20.54.png', '2025-10-31 13:54:04.491'),
(50, 108, 124, '124_dojang-108_bukti_1_31-10-2025_23.21.jpeg', '2025-10-31 16:21:33.767'),
(51, 117, 133, '133_dojang-117_bukti_1_01-11-2025_07.56.jpg', '2025-11-01 00:56:18.559'),
(53, 57, 62, '62_dojang-57_bukti_1_01-11-2025_13.28.jpg', '2025-11-01 06:28:32.917'),
(55, 123, 139, '139_dojang-123_bukti_1_03-11-2025_17.11.jpeg', '2025-11-03 10:11:30.567'),
(56, 117, 133, '133_dojang-117_bukti_2_04-11-2025_08.45.jpg', '2025-11-04 01:45:36.784'),
(57, 125, 142, '142_dojang-125_bukti_1_04-11-2025_10.38.jpg', '2025-11-04 03:38:20.964'),
(58, 10, 11, '11_dojang-10_bukti_1_04-11-2025_13.57.jpeg', '2025-11-04 06:57:49.304'),
(60, 50, 55, '55_dojang-50_bukti_1_04-11-2025_23.32.jpg', '2025-11-04 16:32:45.423'),
(61, 119, 135, '135_dojang-119_bukti_1_05-11-2025_18.53.jpeg', '2025-11-05 11:53:37.286'),
(62, 29, 35, '35_dojang-29_bukti_1_05-11-2025_19.30.jpg', '2025-11-05 12:30:50.683'),
(63, 32, 36, '36_dojang-32_bukti_1_06-11-2025_00.18.jpg', '2025-11-05 17:18:41.044'),
(65, 61, 66, '66_dojang-61_bukti_1_06-11-2025_17.06.jpg', '2025-11-06 10:06:29.213'),
(66, 61, 66, '66_dojang-61_bukti_2_06-11-2025_17.07.jpg', '2025-11-06 10:07:08.592'),
(67, 61, 66, '66_dojang-61_bukti_3_06-11-2025_17.07.jpg', '2025-11-06 10:07:38.123'),
(68, 61, 66, '66_dojang-61_bukti_4_06-11-2025_17.08.jpg', '2025-11-06 10:08:04.033'),
(69, 66, 72, '72_dojang-66_bukti_1_07-11-2025_10.38.jpeg', '2025-11-07 03:38:26.090'),
(70, 115, 130, '130_dojang-115_bukti_1_07-11-2025_15.18.jpeg', '2025-11-07 08:18:27.019'),
(71, 51, 54, '54_dojang-51_bukti_1_07-11-2025_19.05.jpeg', '2025-11-07 12:05:22.951'),
(72, 93, 100, '100_dojang-93_bukti_1_07-11-2025_19.56.jpg', '2025-11-07 12:56:59.438'),
(73, 145, 164, '164_dojang-145_bukti_1_07-11-2025_20.09.jpeg', '2025-11-07 13:09:29.183'),
(74, 140, 157, '157_dojang-140_bukti_1_07-11-2025_21.22.jpeg', '2025-11-07 14:22:13.294'),
(75, 84, 91, '91_dojang-84_bukti_1_07-11-2025_21.59.jpg', '2025-11-07 14:59:21.135'),
(76, 75, 83, '83_dojang-75_bukti_1_07-11-2025_22.04.jpg', '2025-11-07 15:04:17.584'),
(77, 133, 151, '151_dojang-133_bukti_1_07-11-2025_22.08.jpg', '2025-11-07 15:08:54.381'),
(78, 142, 159, '159_dojang-142_bukti_1_07-11-2025_22.12.jpg', '2025-11-07 15:12:17.936'),
(79, 150, 170, '170_dojang-150_bukti_1_07-11-2025_23.30.jpeg', '2025-11-07 16:30:55.914'),
(80, 82, 89, '89_dojang-82_bukti_1_07-11-2025_23.56.jpg', '2025-11-07 16:56:42.058'),
(81, 135, 153, '153_dojang-135_bukti_1_08-11-2025_02.42.jpeg', '2025-11-07 19:42:58.065'),
(82, 106, 121, '121_dojang-106_bukti_1_08-11-2025_09.09.jpeg', '2025-11-08 02:09:10.789'),
(83, 139, 156, '156_dojang-139_bukti_1_08-11-2025_11.18.jpg', '2025-11-08 04:18:23.273'),
(84, 59, 64, '64_dojang-59_bukti_1_08-11-2025_12.40.jpg', '2025-11-08 05:40:30.412'),
(85, 135, 153, '153_dojang-135_bukti_2_08-11-2025_14.08.jpeg', '2025-11-08 07:08:12.076'),
(86, 149, 169, '169_dojang-149_bukti_1_08-11-2025_14.48.jpg', '2025-11-08 07:48:20.675'),
(87, 110, 175, '175_dojang-110_bukti_1_08-11-2025_15.51.jpg', '2025-11-08 08:51:38.708'),
(88, 156, 178, '178_dojang-156_bukti_1_08-11-2025_18.01.jpg', '2025-11-08 11:01:10.058'),
(89, 156, 178, '178_dojang-156_bukti_2_08-11-2025_18.01.jpg', '2025-11-08 11:01:34.169'),
(90, 133, 151, '151_dojang-133_bukti_2_08-11-2025_19.51.jpg', '2025-11-08 12:51:54.803'),
(91, 133, 151, '151_dojang-133_bukti_3_08-11-2025_19.52.jpg', '2025-11-08 12:52:33.310'),
(92, 67, 173, '173_dojang-67_bukti_1_08-11-2025_20.39.jpeg', '2025-11-08 13:39:40.065'),
(93, 103, 116, '116_dojang-103_bukti_1_08-11-2025_20.55.jpg', '2025-11-08 13:55:51.437'),
(94, 16, 18, '18_dojang-16_bukti_2_08-11-2025_20.58.jpeg', '2025-11-08 13:58:29.388'),
(95, 143, 160, '160_dojang-143_bukti_1_08-11-2025_21.31.jpg', '2025-11-08 14:31:53.204'),
(98, 114, 129, '129_dojang-114_bukti_1_08-11-2025_22.04.jpeg', '2025-11-08 15:04:44.089'),
(99, 143, 160, '160_dojang-143_bukti_2_08-11-2025_22.24.jpeg', '2025-11-08 15:24:04.614'),
(100, 143, 160, '160_dojang-143_bukti_3_08-11-2025_22.24.jpeg', '2025-11-08 15:24:21.009'),
(101, 143, 160, '160_dojang-143_bukti_4_08-11-2025_22.24.jpeg', '2025-11-08 15:24:38.553'),
(102, 148, 167, '167_dojang-148_bukti_1_08-11-2025_22.31.jpeg', '2025-11-08 15:31:34.018'),
(103, 128, 145, '145_dojang-128_bukti_1_09-11-2025_08.42.jpg', '2025-11-09 01:42:06.702'),
(104, 97, 104, '104_dojang-97_bukti_1_09-11-2025_08.57.jpeg', '2025-11-09 01:57:50.416'),
(105, 160, 181, '181_dojang-160_bukti_1_09-11-2025_13.44.jpg', '2025-11-09 06:44:05.319'),
(106, 138, 155, '155_dojang-138_bukti_1_09-11-2025_16.27.jpeg', '2025-11-09 09:27:23.324'),
(107, 162, 184, '184_dojang-162_bukti_1_09-11-2025_21.34.jpg', '2025-11-09 14:34:53.470'),
(108, 109, 127, '127_dojang-109_bukti_1_10-11-2025_07.25.jpg', '2025-11-10 00:25:30.157'),
(109, 171, 195, '195_dojang-171_bukti_1_10-11-2025_15.10.jpeg', '2025-11-10 08:10:53.364'),
(110, 171, 195, '195_dojang-171_bukti_2_10-11-2025_15.11.jpeg', '2025-11-10 08:11:09.840'),
(111, 53, 58, '58_dojang-53_bukti_1_10-11-2025_15.29.jpeg', '2025-11-10 08:29:39.243'),
(112, 174, 198, '198_dojang-174_bukti_1_10-11-2025_15.35.jpg', '2025-11-10 08:35:57.768'),
(113, 174, 198, '198_dojang-174_bukti_2_10-11-2025_15.36.jpg', '2025-11-10 08:36:32.851'),
(114, 107, 123, '123_dojang-107_bukti_1_10-11-2025_15.39.jpg', '2025-11-10 08:39:35.430'),
(115, 14, 16, '16_dojang-14_bukti_2_10-11-2025_15.43.jpg', '2025-11-10 08:43:22.207'),
(116, 175, 200, '200_dojang-175_bukti_1_10-11-2025_15.49.jpeg', '2025-11-10 08:49:52.255'),
(117, 71, 78, '78_dojang-71_bukti_1_10-11-2025_16.00.jpg', '2025-11-10 09:00:28.258'),
(118, 71, 78, '78_dojang-71_bukti_2_10-11-2025_16.02.jpg', '2025-11-10 09:02:14.534'),
(119, 102, 114, '114_dojang-102_bukti_1_10-11-2025_16.56.jpeg', '2025-11-10 09:56:53.460'),
(120, 154, 176, '176_dojang-154_bukti_1_10-11-2025_17.27.jpg', '2025-11-10 10:27:57.511'),
(121, 55, 60, '60_dojang-55_bukti_1_10-11-2025_17.28.jpg', '2025-11-10 10:28:15.149'),
(122, 55, 60, '60_dojang-55_bukti_2_10-11-2025_17.28.jpg', '2025-11-10 10:28:43.475'),
(123, 55, 60, '60_dojang-55_bukti_3_10-11-2025_17.28.jpg', '2025-11-10 10:28:59.839'),
(124, 55, 60, '60_dojang-55_bukti_4_10-11-2025_17.29.jpg', '2025-11-10 10:29:10.116'),
(125, 158, 179, '179_dojang-158_bukti_1_10-11-2025_17.38.jpg', '2025-11-10 10:38:54.102'),
(126, 71, 78, '78_dojang-71_bukti_3_10-11-2025_17.41.jpg', '2025-11-10 10:41:10.378'),
(127, 158, 179, '179_dojang-158_bukti_2_10-11-2025_17.42.jpg', '2025-11-10 10:42:34.879'),
(128, 144, 163, '163_dojang-144_bukti_1_10-11-2025_18.00.jpeg', '2025-11-10 11:00:34.082'),
(129, 144, 163, '163_dojang-144_bukti_2_10-11-2025_18.00.jpeg', '2025-11-10 11:00:59.585'),
(130, 144, 163, '163_dojang-144_bukti_3_10-11-2025_18.01.jpeg', '2025-11-10 11:01:12.006'),
(131, 144, 163, '163_dojang-144_bukti_4_10-11-2025_18.01.jpeg', '2025-11-10 11:01:26.468'),
(132, 46, 51, '51_dojang-46_bukti_1_10-11-2025_18.06.png', '2025-11-10 11:06:59.124'),
(133, 157, 183, '183_dojang-157_bukti_1_10-11-2025_18.31.jpg', '2025-11-10 11:31:13.404'),
(134, 27, 29, '29_dojang-27_bukti_1_10-11-2025_18.41.jpg', '2025-11-10 11:41:06.429'),
(135, 27, 29, '29_dojang-27_bukti_2_10-11-2025_18.42.jpg', '2025-11-10 11:42:18.020'),
(136, 94, 101, '101_dojang-94_bukti_1_10-11-2025_19.35.jpg', '2025-11-10 12:35:37.845'),
(137, 94, 101, '101_dojang-94_bukti_2_10-11-2025_19.36.jpg', '2025-11-10 12:36:03.715'),
(138, 177, 205, '205_dojang-177_bukti_1_10-11-2025_19.37.jpg', '2025-11-10 12:37:24.956'),
(139, 177, 205, '205_dojang-177_bukti_2_10-11-2025_19.38.jpg', '2025-11-10 12:38:09.248'),
(140, 141, 158, '158_dojang-141_bukti_1_10-11-2025_19.42.jpeg', '2025-11-10 12:42:43.699'),
(141, 107, 123, '123_dojang-107_bukti_2_10-11-2025_19.48.jpg', '2025-11-10 12:48:55.620'),
(142, 168, 192, '192_dojang-168_bukti_1_10-11-2025_21.05.webp', '2025-11-10 14:05:09.469'),
(143, 27, 29, '29_dojang-27_bukti_3_10-11-2025_21.05.jpg', '2025-11-10 14:05:28.193'),
(144, 104, 119, '119_dojang-104_bukti_1_10-11-2025_21.27.jpg', '2025-11-10 14:27:59.152'),
(145, 68, 74, '74_dojang-68_bukti_1_10-11-2025_23.19.jpg', '2025-11-10 16:19:34.944'),
(146, 68, 74, '74_dojang-68_bukti_2_10-11-2025_23.25.jpg', '2025-11-10 16:25:09.846'),
(147, 152, 172, '172_dojang-152_bukti_1_11-11-2025_00.24.png', '2025-11-10 17:24:32.794'),
(148, 34, 39, '39_dojang-34_bukti_1_11-11-2025_07.11.png', '2025-11-11 00:11:57.585'),
(149, 47, 52, '52_dojang-47_bukti_1_11-11-2025_08.03.jpg', '2025-11-11 01:03:25.466'),
(150, 95, 102, '102_dojang-95_bukti_1_11-11-2025_08.19.jpeg', '2025-11-11 01:19:25.842'),
(151, 73, 80, '80_dojang-73_bukti_1_11-11-2025_11.16.jpg', '2025-11-11 04:16:43.926'),
(152, 71, 78, '78_dojang-71_bukti_4_11-11-2025_15.27.jpg', '2025-11-11 08:27:40.025'),
(153, 151, 171, '171_dojang-151_bukti_1_11-11-2025_15.58.jpg', '2025-11-11 08:58:59.804'),
(154, 178, 206, '206_dojang-178_bukti_1_11-11-2025_18.30.jpg', '2025-11-11 11:30:32.747'),
(155, 178, 206, '206_dojang-178_bukti_2_11-11-2025_18.40.jpg', '2025-11-11 11:40:08.615'),
(156, 178, 206, '206_dojang-178_bukti_3_11-11-2025_20.00.jpg', '2025-11-11 13:00:18.803'),
(157, 178, 206, '206_dojang-178_bukti_4_11-11-2025_20.00.jpg', '2025-11-11 13:00:37.748'),
(158, 178, 206, '206_dojang-178_bukti_5_11-11-2025_20.01.jpg', '2025-11-11 13:01:07.627'),
(160, 120, 136, '136_dojang-120_bukti_1_12-11-2025_08.37.jpeg', '2025-11-12 01:37:32.627'),
(161, 165, 188, '188_dojang-165_bukti_1_12-11-2025_09.51.jpeg', '2025-11-12 02:51:07.477'),
(162, 167, 191, '191_dojang-167_bukti_1_12-11-2025_10.59.jpg', '2025-11-12 03:59:37.319'),
(163, 185, 213, '213_dojang-185_bukti_1_12-11-2025_14.16.jpeg', '2025-11-12 07:16:54.651'),
(164, 192, 218, '218_dojang-192_bukti_1_13-11-2025_08.00.jpeg', '2025-11-13 01:00:03.855'),
(165, 181, 210, '210_dojang-181_bukti_1_13-11-2025_08.17.jpeg', '2025-11-13 01:17:13.448'),
(166, 176, 203, '203_dojang-176_bukti_1_13-11-2025_08.57.jpg', '2025-11-13 01:57:22.957'),
(167, 65, 71, '71_dojang-65_bukti_1_13-11-2025_09.08.jpeg', '2025-11-13 02:08:35.546'),
(168, 65, 71, '71_dojang-65_bukti_2_13-11-2025_09.08.jpeg', '2025-11-13 02:08:59.280'),
(169, 65, 71, '71_dojang-65_bukti_3_13-11-2025_09.09.jpeg', '2025-11-13 02:09:21.415'),
(171, 65, 71, '71_dojang-65_bukti_4_13-11-2025_09.11.jpeg', '2025-11-13 02:11:23.848'),
(175, 179, 207, '207_dojang-179_bukti_4_13-11-2025_10.54.jpg', '2025-11-13 03:54:40.860'),
(176, 179, 207, '207_dojang-179_bukti_5_13-11-2025_10.55.jpg', '2025-11-13 03:55:24.024'),
(177, 179, 207, '207_dojang-179_bukti_6_13-11-2025_10.55.jpg', '2025-11-13 03:55:50.478'),
(178, 179, 207, '207_dojang-179_bukti_7_13-11-2025_10.56.jpg', '2025-11-13 03:56:13.161'),
(179, 179, 207, '207_dojang-179_bukti_8_13-11-2025_10.56.jpg', '2025-11-13 03:56:35.605'),
(180, 179, 207, '207_dojang-179_bukti_9_13-11-2025_10.56.jpg', '2025-11-13 03:56:51.848'),
(181, 179, 207, '207_dojang-179_bukti_10_13-11-2025_10.57.jpg', '2025-11-13 03:57:09.320'),
(182, 179, 207, '207_dojang-179_bukti_11_13-11-2025_10.57.jpg', '2025-11-13 03:57:24.386'),
(183, 179, 207, '207_dojang-179_bukti_12_13-11-2025_10.57.jpg', '2025-11-13 03:57:42.839'),
(184, 179, 207, '207_dojang-179_bukti_13_13-11-2025_10.57.jpg', '2025-11-13 03:57:59.854'),
(185, 179, 207, '207_dojang-179_bukti_14_13-11-2025_10.58.jpg', '2025-11-13 03:58:36.001'),
(186, 179, 207, '207_dojang-179_bukti_15_13-11-2025_10.58.jpg', '2025-11-13 03:58:54.036'),
(187, 179, 207, '207_dojang-179_bukti_16_13-11-2025_10.59.jpg', '2025-11-13 03:59:09.084'),
(188, 179, 207, '207_dojang-179_bukti_17_13-11-2025_10.59.jpg', '2025-11-13 03:59:25.634'),
(189, 186, 214, '214_dojang-186_bukti_1_13-11-2025_12.27.jpg', '2025-11-13 05:27:53.737'),
(190, 187, 215, '215_dojang-187_bukti_1_13-11-2025_15.33.jpg', '2025-11-13 08:33:25.560'),
(191, 183, 211, '211_dojang-183_bukti_1_13-11-2025_19.29.jpeg', '2025-11-13 12:29:26.908'),
(192, 183, 211, '211_dojang-183_bukti_2_13-11-2025_19.36.jpg', '2025-11-13 12:36:04.724'),
(193, 52, 56, '56_dojang-52_bukti_1_13-11-2025_19.42.jpg', '2025-11-13 12:42:34.618'),
(194, 118, 134, '134_dojang-118_bukti_1_13-11-2025_21.19.jpg', '2025-11-13 14:19:37.845'),
(195, 118, 134, '134_dojang-118_bukti_2_13-11-2025_21.19.jpg', '2025-11-13 14:19:59.380'),
(196, 195, 221, '221_dojang-195_bukti_1_13-11-2025_21.24.jpg', '2025-11-13 14:24:27.244'),
(197, 161, 182, '182_dojang-161_bukti_1_13-11-2025_23.47.jpg', '2025-11-13 16:47:41.103'),
(198, 199, 227, '227_dojang-199_bukti_1_14-11-2025_00.09.jpg', '2025-11-13 17:09:39.860'),
(199, 202, 231, '231_dojang-202_bukti_1_15-11-2025_19.09.jpg', '2025-11-15 12:09:14.722'),
(200, 130, 148, '148_dojang-130_bukti_1_16-11-2025_13.27.jpg', '2025-11-16 06:27:04.935'),
(201, 21, 25, '25_dojang-21_bukti_2_19-11-2025_13.22.jpg', '2025-11-19 06:22:06.981');

-- --------------------------------------------------------

--
-- Table structure for table `tb_admin`
--

CREATE TABLE `tb_admin` (
  `id_admin` int(11) NOT NULL,
  `nama` varchar(150) NOT NULL,
  `id_akun` int(11) NOT NULL
) ENGINE=InnoDB DEFAULT CHARSET=utf8mb4 COLLATE=utf8mb4_unicode_ci;

--
-- Dumping data for table `tb_admin`
--

INSERT INTO `tb_admin` (`id_admin`, `nama`, `id_akun`) VALUES
(1, 'Super Admin', 1);

-- --------------------------------------------------------

--
-- Table structure for table `tb_admin_kompetisi`
--

CREATE TABLE `tb_admin_kompetisi` (
  `id_admin_kompetisi` int(11) NOT NULL,
  `id_kompetisi` int(11) NOT NULL,
  `nama` varchar(191) NOT NULL,
  `id_akun` int(11) NOT NULL
) ENGINE=InnoDB DEFAULT CHARSET=utf8mb4 COLLATE=utf8mb4_unicode_ci;

--
-- Dumping data for table `tb_admin_kompetisi`
--

INSERT INTO `tb_admin_kompetisi` (`id_admin_kompetisi`, `id_kompetisi`, `nama`, `id_akun`) VALUES
(1, 1, 'Admin Kompetisi 1', 3);

-- --------------------------------------------------------

--
-- Table structure for table `tb_akun`
--

CREATE TABLE `tb_akun` (
  `id_akun` int(11) NOT NULL,
  `role` varchar(50) NOT NULL,
  `email` varchar(255) NOT NULL,
  `password_hash` varchar(255) NOT NULL
) ENGINE=InnoDB DEFAULT CHARSET=utf8mb4 COLLATE=utf8mb4_unicode_ci;

--
-- Dumping data for table `tb_akun`
--

INSERT INTO `tb_akun` (`id_akun`, `role`, `email`, `password_hash`) VALUES
(1, 'ADMIN', 'admin@example.com', '$2b$10$JqYyCO1AlA3ukfxEfw0sgeitgg6NlIh93XyST/6bzBgMXePjCfrTS'),
(2, 'PELATIH', 'pelatih@example.com', '$2b$12$ghUrqLZguh/8t.mMT/KJpue2rlPxyKvy8/2dhMIZuNtfGsizq1liS'),
(3, 'ADMIN_KOMPETISI', 'adminkompetisi@example.com', '$2b$12$6DQS4xm3.bL.qk89419YUuvgVYLM6Trth30uLYznM5HE03ABW1buq'),
(6, 'PELATIH', 'falih@gmail.com', '$2b$12$ZCdQboP6OuHaullhghFd1urI6QCorWCWRpKx/EkknRsR4C/KIL3re'),
(7, 'PELATIH', 'testemail@contoh.com', '$2b$12$e0OVTn/Av17W/ZZVj03cxOkeIKJj3MWriIM54/s4QeJHq/iz3X9Uq'),
(8, 'PELATIH', 'dianapermatasari8713@gmail.com', '$2b$12$pP5Wlgrrk/MPcKB9jzS/ou88C6IeQtzFP25GcMZSBxSQD1BzNlfnK'),
(9, 'PELATIH', 'falihelmandag@gmail.com', '$2b$12$WRI5lNHXAnfcFvyR0cIS9.oYpDDGCnPIT1U/.DFHqnJiOWehpe5De'),
(10, 'PELATIH', 'sayadani.pln@gmail.com', '$2b$12$MZnRn3VM/aWHxFg6IAdo/.KGOsCMDxWkS5NmyL0Y/b0eOD0VQG1Fi'),
(11, 'PELATIH', 'muhammadnuryansyah876@gmail.com', '$2b$12$.zoSJzlXifVzqgVGcXHOFuHJx8XtoXdf.XBXxZzh.jXJP96JZBQq6'),
(12, 'PELATIH', 'musepista@gmail.com', '$2b$12$YzsasI7eX4x4FWsHDaWyGeIpuazAUvZBQZU8dwrrrmzzaPp5MOzwC'),
(13, 'PELATIH', 'nabilaandari13@gmail.com', '$2b$12$YyFpWO8lmLUU3OuuddM59uzm0mEdq4t59u.QVy3BYkxbp70y5ExqG'),
(15, 'PELATIH', 'dummy@gmail.com', '$2b$12$WB13J.f7XslYQrRKAUbEtudZd3TXc/EJKfWpNfdmvDFFA1J5ri2qa'),
(16, 'PELATIH', 'pranowo.tfc@gmail.com', '$2b$12$ICcX5gZKT1wTV5u06RN93.PeR6dTD8tah6AcKpmusvl0rrzd0HqF2'),
(17, 'PELATIH', 'devriernandi@gmail.com', '$2b$12$3/bW2Fq44K4Chb16Whbgm.H.HEokQ/p8OJP.47MigKkJKl01EPcbu'),
(18, 'PELATIH', 'moriskyon@gmail.com', '$2b$12$VNFuzFhbUjS.k8KLcUdUS.tQliFHTf97gWVNRceWKtv6FIPYeUHb6'),
(19, 'PELATIH', 'taekwindobeacukai@gmail.com', '$2b$12$LqlCaTWf.RC4FN2Hv0GBCetanWRru1nRAxZxOn0fgDSaSnAsGPRp2'),
(20, 'PELATIH', 'bangekoputra@gmail.com', '$2b$12$05M77ST1GGWmTnWdcjP1EuJIjv9hPPFSZRt8VsxnLPiqFN.XNXiw6'),
(23, 'PELATIH', 'ksatria.taekwondo0404@gmail.com', '$2b$12$b9fP9a6X9ysDeesM8KzKm.OKgXRz6DFFUrpwD3j89p9B9gLP3hFgq'),
(24, 'PELATIH', 'jinkiain1@gmail.com', '$2b$12$PYDAYVfFs.NO/hNUQRy5w.SjCy9V1R0SALuXROoy9EZj.8LKvNORm'),
(26, 'PELATIH', 'abiiqi21.ilham@gmail.com', '$2b$12$31Xx/keoNi4tgB.0f7X1E.EqASNs7pJSk7GxQxKfMWDLmYKC1uAn6'),
(27, 'PELATIH', 'afifmuhammadfajar@gmail.com', '$2b$12$D4G.sRCwgNJ2jRW4XrIOWexG1aVTrrXVOPlEHampsIBTuWrh/Deg2'),
(28, 'PELATIH', 'adstaekwondoacademy@gmail.com', '$2b$12$OzSMohXWIMVoZfFtA7Lp.uDnlcSdvB4j6hoWDhZrJ7RvxtKH/W0Q.'),
(29, 'PELATIH', 'refdinaldevi@gmail.com', '$2b$12$o6GKqBd4bMD5sbioVz41WuBTmvj66BRsI55kxEapC2Qf0kDGupmK2'),
(30, 'PELATIH', 'trikarahayu76@gmail.com', '$2b$12$bZmiSrBE4t1sSYTtNgvvzezmNd1sV4LxmT2RT2FQ8x48aG3R5I2/W'),
(31, 'PELATIH', 'yudi3055@gmail.com', '$2b$12$T8F41voQMU5Dk4Phd17.oueC36dUkiNmr347vgH8E64zhv2m3Js2u'),
(32, 'PELATIH', 'yefrinovian@gmail.com', '$2b$12$yUDFKy496aJL92YBisNKbuYwCiyuAEh70QcopCNyBR1XBz9xsQYbi'),
(34, 'PELATIH', 'novitasari908700@gmai.com', '$2b$12$qzwgd5pIzR5hmYfah5J31.cxfKm8ZIRs0LZDR1RAOskckEWLYvNdm'),
(36, 'PELATIH', 'andriwillyanto8@gmail.com', '$2b$12$Fl4w6vj8TQWo8sKZ1Stmau/HHS7cDcD3rHlwLxvxjsdFbNT59o9XK'),
(37, 'PELATIH', 'sudarmanlie@gmail.com', '$2b$12$jQPJArtpBDkp7MLmsZV2Du4Y9q74zpc3AOn0Jj58zDgwEDFcd4soi'),
(38, 'PELATIH', 'abdulajabb1@gmail.com', '$2b$12$xD.dv1Fu42l4cHDpdWmEvOb/T0iHO3KGP9vdLZNynD7sgx1DlMu7y'),
(39, 'PELATIH', 'pegasustaekwondoindonesia@gmail.com', '$2b$12$zCngu/kGXvTtMlnXHyJIWeVGOx/RLch7NoXGlKwvNoi7JQUMXkgGi'),
(40, 'PELATIH', 'rezafajriansyah02@gmail.com', '$2b$12$NvNdfh4zrIiXvPIW47dUc.oaHUJSPWPR5iD1kA3L.cWGSB8PgEap.'),
(41, 'PELATIH', 'abda.28jan@gmail.com', '$2b$12$hlBI.coMdOd0jTXkM9jBj.LyDxzmBd8gfN8BQviTMPOMmF5gdrI5C'),
(42, 'PELATIH', 'izetimamsoleh20@gmail.com', '$2b$12$/GKxbweJXT9CK8gGQXwznOrNH8bCXRV4ZnPrTlYVPczdaUeHDz41.'),
(43, 'PELATIH', 'auliaika799@gmail.com', '$2b$12$YdeJrojmHLOguvw9rz5qdO0hUW6FH.nye/vuZMH7m.ZAE/H.LVH22'),
(44, 'PELATIH', 'rbbhermansyah702@gmail.com', '$2b$12$pJHZ4h7RUYouX/nlXQiFZeOjRXxRUpDGavjfLbvX/LRzgOcCh0K2.'),
(45, 'PELATIH', 'pricillyanabila@gmail.com', '$2b$12$8KrG6posaLymNVUYzXNGzOvJOQXO/4tgnhat8T/TzPvsjXbeqDLDS'),
(46, 'PELATIH', 'm.rikimardiansyah@gmail.com', '$2b$12$/xmuVTpO/zQmwHgNm2fz.Oq5yFWBuV8djTaT1ntYmpH1j9KaN4IXS'),
(52, 'PELATIH', 'sevtaramardyah@gmail.com', '$2b$12$h0Q4kNM2/jT6WYM/F5BBqeAlUkdMOeMsV98b2MNCCn5bt60zqLyCa'),
(53, 'PELATIH', 'rizkyristisari@gmail.com', '$2b$12$Ym7DK2cbcUm7pPAMCwVGHuJ/eMHgYM0O/Yj704xdEBBee/8BdeEGi'),
(54, 'PELATIH', 'firda.octavia87@gmail.com', '$2b$12$qNztWNoaBLj/8RS6SQ2Ds.I2SXLzxzzm.CRNRW9SHK73E3ZGX.K5.'),
(55, 'PELATIH', 'awa@gmail.com', '$2b$12$52Yp375TtYsCOM8j3f/QWeYmfbIWZKC4EGkIK6CTPUpWiCC0n6QAm'),
(56, 'PELATIH', 'sonyaagustin230802@gmail.com', '$2b$12$C8HzBynjmPQOm9efyKxD3u5n1nOfQ4QC57H4w6aeRhGXRlCdnD/3S'),
(57, 'PELATIH', 'kehutananjambiclub@gmail.com', '$2b$12$OzzTGLKVfvV57QKG01GjeuGX18VHPCSrgVNYzMLZ9VNE6/8tB14u.'),
(58, 'PELATIH', 'binarazwaranasharfian_uin@radenfatah.ac.id', '$2b$12$jbXX7eJDxX4t8fywARVdhewHlnxdp05ruznF7QaD3MNCD5gGJViHG'),
(60, 'PELATIH', 'dikaerwina@gmail.com', '$2b$12$syoB.eHpxOdmCLvb/BEGJ.rScyr3OH7XKinrAY5yCZ3PsXCk2OaKK'),
(61, 'PELATIH', 'gf.ramoh@gmail.com', '$2b$12$Gbv3xILF4npcwmFYzpNznefIGlRbsroxU4lqu4YHvoGcppG39bJsC'),
(62, 'PELATIH', 'dwiharrylaksono91@gmail.com', '$2b$12$1oiQQNeyJWB0may4c7p85OIQAmf0SJA0IKIGhOwD9RFQlTVwPOe7u'),
(63, 'PELATIH', 'ramba55252@gmail.com', '$2b$12$jFYcY/bJoUVHWF1YHNBPOeByy0a0VIhG4JkgkUIb5s0UVy0C4KxOu'),
(64, 'PELATIH', 'yogisetiawan@fik.unp.ac.id', '$2b$12$JaH2STXEDIarHfkBSUsFwud6HZPiBqBjnJ8ZulYFwMAis54ZSN4Vm'),
(65, 'PELATIH', 'garda.muhammad@gmail.com', '$2b$12$xqivuL6XT7o35bP34UEnqOMZkAqINoGCDd3NId1nJjTsWKHBJtnzy'),
(66, 'PELATIH', 'hotmanparuliantkd@gmail.com', '$2b$12$4Q.UaXJFIUkqXV6oIhYE3.R9Sew9PNgc3G3V.3G/vuwkxVU/TnQTe'),
(67, 'PELATIH', 'gametcsampit@gmail.com', '$2b$12$x.PmV3AHBtvmL.lOE8k3A.jbdmYplzye9Vyt1OR0OevK5yMGaw9oy'),
(68, 'PELATIH', 'prasetyomujiharto@gmail.com', '$2b$12$M6M.Uu29xiIiHAL.doQk8u3fRwPwDSRGpVSwTpDIuKOFLMb0KnDDu'),
(69, 'PELATIH', 'istik143@gmail.com', '$2b$12$VvUVp1Wjmor894JYJ0QOKuxE3rQZCsNgzbJWNdgmDyZh/7Go5eUp2'),
(70, 'PELATIH', 'andypancasoemarno@gmail.com', '$2b$12$Bsco6JzFDUQ1akkuwt5mQuwhMXw4syIPx81XgwIxGTyJg7kEF8ZhK'),
(71, 'PELATIH', 'revendi.123@gmail.com', '$2b$12$.YmNOdtIMFdiFWIZXpb.U.S7ptPZNdYiUmo7tRtlLSKAMynfrcmbe'),
(72, 'PELATIH', 'yunita30nurma@gmail.com', '$2b$12$WnD7ItoFdDSSLbSWY/Qp8.LKvep.fK4sCANC5w4yNdjdVoBTj2GvG'),
(73, 'PELATIH', 'sofiansopan0673@gmail.com', '$2b$12$PRQVrifGF/R90KlGaHTNKuTl9Z90j/o4o9dA9K2Jpvk6zQIvu7Fie'),
(74, 'PELATIH', 'alyciazizi3@gmail.com', '$2b$12$hJwv1/QWdSH2XszKtrX69udlnq444kBl0q9jJobBjSbjqhgTtxHbC'),
(75, 'PELATIH', 'mclaudiopratama662@gmail.com', '$2b$12$tXpMe/FuvaTIz80kd5upe.elkw2HoViF/wAmAumoTI2G4vu6C1iIu'),
(76, 'PELATIH', 'bjmasterwarrior.bj@gmail.com', '$2b$12$KvK7BGgpaXRX/45hoPqnHeZlIVMkgqhxTFApA/CTyd4QpjRgzpLvW'),
(77, 'PELATIH', 'iyabukabakutapi12@gmail.com', '$2b$12$oBkhjkzAsmuoxZrz.xLlp.oAdJp4m7HFZEe0GalSeZwwbqYHorY1u'),
(78, 'PELATIH', 'iyabukanakutapi12@gmail.com', '$2b$12$9A6kf9nsqX7kuLq/UVEcKOQFWX6LjctPrqxVB/pcj7eDM/rN7bqQS'),
(79, 'PELATIH', 'savictaekwondo@gmail.com', '$2b$12$w3QWiWjMRJG9MLmu30rK8eyEHzxp/1APHfjpzPUsa7y/If8bsV7t2'),
(80, 'PELATIH', 'hirzasumaalek@mail.com', '$2b$12$bq0dpQzpwpfNYyGVFG4DfuYMKth9Ig8QAeIPUUd9/ir9sefKacvte'),
(81, 'PELATIH', 'kujutaekwondoacademy10@gmail.com', '$2b$12$OmIQTP7z/sXdsd3Zv3XcGOiDxkDhQ6p9djUaURS5o2u85Q05QsRG2'),
(82, 'PELATIH', 'alvi.and12smart@gmail.com', '$2b$12$CWuWlcDv3o4BPJzLdn.5G.y1x2n9UriTKMIOEYXMoIr/QB/uno.LG'),
(83, 'PELATIH', 'tpcakademi@gmail.com', '$2b$12$Uuh/iNMijaJo.oScNPG4xOmEJUyrzmlMzWnkFHfJkm7JlzsSeX7li'),
(84, 'PELATIH', 'alianingsih64@gmail.com', '$2b$12$0fOdGdGCT1xcoov3Dr7n6OPIVr9U/94ZHNs21tJ8g685BXNa0E5R.'),
(85, 'PELATIH', 'r.aamalia89@gmail.com', '$2b$12$G7VDrwmZ.Jz7rKVU7tJr.eM5gXb68L69bZPaT.r90mZovAznmZQ36'),
(86, 'PELATIH', 'smuhamad001@gmail.com', '$2b$12$3VUEp4BuPjyYXunx206tSeRhRKuWnPA3.nzWrKKNUXrNrjLZXBg3u'),
(87, 'PELATIH', 'andiputragunawan35@gmail.com', '$2b$12$BvsiOWYWomc27nOjHJ9w8.HMnKGK3JTXLjwLKhDDsfd10.hwFWFX2'),
(88, 'PELATIH', 'arisal1980@gmail.com', '$2b$12$NJZ5UiiZ2vDC7JXZpqoIuOyF/P18yS19.aPVwi73FJ36J60j6LhW.'),
(89, 'PELATIH', 'rfandia@gmail.com', '$2b$12$hpmMu01ioHIimIJlcCvI5.9p8EIbMBUBi.f3DlKyPYDqTbi4nAnM6'),
(90, 'PELATIH', 'bapendataekwondosquad@gmail.com', '$2b$12$jPCZ9c3zqdKWTvDiVcegKelYRoJoxKMrwInC/hAnnJdGW2AAU5uBu'),
(91, 'PELATIH', 'dioqamara26@gmail.com', '$2b$12$alIvJ5AcAMpfYIQ9mXDvU.0XgP3Lcxu.pDKGALLvwhFaE5XH4kYB.'),
(92, 'PELATIH', 'fafa@gmail.com', '$2b$12$rkQ5YPPWvVkbXUHmNy3yyeMrwumlwAc7TJtdY5SAcw5G4mEftI/nm'),
(93, 'PELATIH', 'dedyhusnan08@gmail.com', '$2b$12$19rsrWT8GCVxAnU3wilRZ.sssFku2Uwn2JwYT93x/Ri5BWc5/KLmC'),
(94, 'PELATIH', 'ulilamrypkp5@gmail.com', '$2b$12$rhRQ0dxwl.0viXWvJTgGPeF6RV6xOzleGLeRtmNbnRFNHanfLmz9q'),
(95, 'PELATIH', 'nandaangraini2720@gmail.com', '$2b$12$dfQc8dIUOtjFRp9wqpNFCu5I9ftmu9htHc8j.dr7m9GmDoEBJUjiW'),
(96, 'PELATIH', 'merdinepatro@gmail.com', '$2b$12$41jPfBXNCRH6rxhqiT2KyOBeLdJXpqHWN2T7dTm1LdSmftO34itbe'),
(97, 'PELATIH', 'soniamasudd@gmail.com', '$2b$12$Pt5RI4cOWTBsC9Kt5mIxnOUNyixMvC4Y4ZAWCQ56wADnzjaQV7eWO'),
(98, 'PELATIH', 'irwantugimanto91@gmail.com', '$2b$12$ZIGc80PrZGUsgyxbhnk0IeiuSEWqULTgu0g2xlACs89uMKkuPJ3mi'),
(99, 'PELATIH', '212eq212@gmail.com', '$2b$12$3lqIh63RHFNl3bs2AweIl.CJYwdIFvqoHbpZ.Lj01B.yOWcPxoF4K'),
(100, 'PELATIH', 'chendribf82@gmail.com', '$2b$12$sAu/1Vidb0rL24n5iSF79e/U5y6maAgxpW5F.w0XBL12gLqg1O0ve'),
(101, 'PELATIH', 'bayubae1990@gmail.com', '$2b$12$il9AqBWhMDpdQ3NTwoxwx.rbiBR1T47D99k5q7vcOHOg.mn4RHgkC'),
(102, 'PELATIH', 'rahmatwijaya373@gmail.com', '$2b$12$Q9qGMaW.Fk8BINpvBSDWAOwbMKhevbc.zWphCYAdanPnJk9Cl8VTS'),
(103, 'PELATIH', 'nrohmanvivo@gmail.com', '$2b$12$syK6AatG9reJ0M3pl9nUL.UZN0hkz7OO7OGRYc5.PZVU9Ux9KuDR6'),
(104, 'PELATIH', 'donyprasatioo@gmail.com', '$2b$12$Lr3V7r814YDBUcgYvEImd.wGNehJ1/l24InWcrPkDNX21YCwHeHve'),
(105, 'PELATIH', 'animeindo1998@gmail.com', '$2b$12$ReOWxZcMsD4MQ3QILqrDC.SsZxaxUL3/Dpqhw9Mme.9TuqhnSTY/i'),
(106, 'PELATIH', 'nitapurnaningsih17@gmail.com', '$2b$12$ao8lmONl6TWLtXQnV.dfo.DYyXm0l.9wpomjH86R5Jaua9rE2gWDu'),
(107, 'PELATIH', 'farrel72019@gmail.com', '$2b$12$.kjIK2O69ZUW49XzGFqmEOb5WLd7t.mVUnhJ9.psPCCrgIOy4km36'),
(108, 'PELATIH', 'raihanpz178@gmaigmail.com', '$2b$12$iRpqaYC/yb1PNnUr6HqvXOOQtA5M.1wapD9xHMuQ/0JMAttOFS2OO'),
(109, 'PELATIH', 'ulmaita75@gmail.com', '$2b$12$cn3JyS/rlYwraVyRb9BK8OnEP3m7bT2IW1QnqoMiXAQj0dGcWWWg6'),
(110, 'PELATIH', 'baguscuy210800@gmail.com', '$2b$12$7ZxkNXxxf8u57YHg.xC.ouyxeKMPB.QYLG0pubOMDzijoYU3IPshO'),
(111, 'PELATIH', 'manroejaktim@gmail.com', '$2b$12$p0ls5bND91gSMi6N6JV9G.GedUB/I/Q97XL9Ko8rRVZ2rpYheto5C'),
(112, 'PELATIH', 'lateeftkd@gmail.com', '$2b$12$nciEw0wM3bfHLrNaxfXHauveGeSADMxaQWhkcCRDpNVYWXAU9YDMW'),
(113, 'PELATIH', 'dimasns278@gmail.com', '$2b$12$MpXJ95RpXlcLJJoDKHzYZevH3eJylsDgryLDjVWPJCaBdGOUBWKea'),
(114, 'PELATIH', 'wahyunur9885@gmail.com', '$2b$12$kPxey8KVbv1Usjz..rQQ4.R1dSgselVSakWHNsULeVOpetToENaAe'),
(115, 'PELATIH', 'diebesteclub2020@gmail.com', '$2b$12$bZ2k.HAzzQtuTJzBy4D10OiU2yIg/9JpeE3GRf.vAMov7LxSQna1y'),
(116, 'PELATIH', 'metidesiana96@gmail.com', '$2b$12$6ph0BwCBiOm93EcA8VZCfugCfHUJqSSxKLmn3tv6RU0a.B5UZiX9i'),
(117, 'PELATIH', 'ramadhaniaisyah1108@gmail.com', '$2b$12$9UHmQRN9lCWDqhxYuumi4ecpRqdjgbGzTPxpNLqzKrTbnf1lx49A.'),
(118, 'PELATIH', 'handokojambi58@gmail.com', '$2b$12$VOYKbNjQzbm2Ao6mXwDFlu8r0EZfvjPAtUWS9K1PA99CfClH9RgtK'),
(119, 'PELATIH', 'syfakrnsyafakirana@gmail.com', '$2b$12$1A2sc1n26SJZlKPzeHAZp.1ib0Hgbq/hghu9WMoya1CWfeuX.uMde'),
(120, 'PELATIH', 'oktarinixx@gmai.com', '$2b$12$r/mwHAv77jy1rpBIEQah5O9zY01DS00tMjzUZJodw1DWFg0OEOVYC'),
(121, 'PELATIH', 'endra.suganda1990@gmail.com', '$2b$12$AVf2aamdFj99JlDIVhCrdudSWamhdh0Z0IXFAr9hfCdSATX52f1iy'),
(122, 'PELATIH', 'betataekwondo@gmail.com', '$2b$12$hSqMmouNTf5zi4/sNE1lJ.7MnCM49KzRce8sEs11PvWT2r3mL.ju.'),
(123, 'PELATIH', 'taekwondotwortclampung@gmail.com', '$2b$12$qIGJF0aqNgTvZSKukFcZGuU.hhezM52FghpbhH/VVQs8ZAsCZF18C'),
(124, 'PELATIH', 'syefribaturaja@gmail.com', '$2b$12$7VPDkgwp5iSJxRewcrjEy.cokTPk5o2H5tkfzeTux2u2sqnTX3IyW'),
(125, 'PELATIH', 'saptotobinak@gmail.com', '$2b$12$NIBc4NbR6e1QAcFyfGwjNee6l9MjkPTch.UgvQc2rU6L.WzVmkGs6'),
(126, 'PELATIH', 'yunasditiya@gmail.com', '$2b$12$Ft0GdYyD4KIE1B.v3BAxNeuJs699aPb88qm3lTA3Lffrtr1DWZvtC'),
(127, 'PELATIH', 'setdaaceh10@gmail.com', '$2b$12$ICax9mLh.z2Og02u9FXcjevFjHESyvprnmT1ihg3BNy4jThCZ92S6'),
(128, 'PELATIH', 'jhongirsang@ust.ac.id', '$2b$12$1/FDx0CoefYzM3uqnfzHseH5b136RpN9eiSkxVbZQw4DNVqjLNl0q'),
(129, 'PELATIH', 'mfahri0802@gmail.com', '$2b$12$NM1HMdlSHTEsgab4sA95HeeGLBTwNUmg1fhiCBq18cI3COGwAMEg6'),
(130, 'PELATIH', 'athinu001@gmail.com', '$2b$12$C7ZyXGUNdhdwv1ORLmqBh.p8FaTWkuBb.sPmy8UNuIh0EPuGDZZy.'),
(131, 'PELATIH', 'deansaktipratama@gmail.com', '$2b$12$vQiqNKCfRqGU17941/fMne/1EldFMcvygZ51006/B2jXd49Bnv8am'),
(132, 'PELATIH', 'agitcahyanegara@gmail.com', '$2b$12$0Df9pkyyuSiV/h1Id1yKt.sUUPN0MOCQcjWgI.yr2y0uryiUwQvY6'),
(133, 'PELATIH', 'merihandayaniuniv@gmail.com', '$2b$12$MZFOiUet9kAG/Hk7Uf1tBOIVioGZnhb3vVSW55Asdn4dQUd4zM9.i'),
(134, 'PELATIH', 'akademitaekwondogarudaputih@gmail.com', '$2b$12$/IzTmZ3tHCZwoh8QT2aaMulCBBJlLlfIrJfpLa8IuSBaftcXVeHNC'),
(135, 'PELATIH', 'arifwsoebagio@gmail.com', '$2b$12$2OH5kcXv3I9lpt4N5DXfkuw6yoR5a54WWXnchMDdVeSV.wwGlIFcy'),
(136, 'PELATIH', 'adriekaputr@gmail.com', '$2b$12$5gIIMZkGMElqe8q0xJPPR.kMZbbpLFk4yV4iLh6OY4YqsZ6Z5bAHC'),
(137, 'PELATIH', 'meldikhai@gmail.com', '$2b$12$F3S4QIzme.YcZzAURE1YGOa039EpgGPUDseO5rc3BUg4U0inS/Aw2'),
(138, 'PELATIH', 'parulianchagi@gmail.com', '$2b$12$rVciciR0IIi.HSnivNYo.u5Oxlkm0z0knUeToBiv8dASeBBwpjFjC'),
(139, 'PELATIH', 'prabuoffice122@gmail.com', '$2b$12$sPM9P2mAUttP8WSduc4QuefIXv2ysWgMSXoIKcUFSkZ7YGoDS6Lxe'),
(140, 'PELATIH', 'noviajbi2019@gmail.com', '$2b$12$D/W4gJoAJM1Zj56a.WIwBeQNPjYQfn.8ADxj3VfcbgQAvmvofFyIO'),
(141, 'PELATIH', 'mahaliharki@gmail.com', '$2b$12$pE/pS3yzuT5xAP8s2swYvu24BXHkWg7x0dje23PNZ0BEiQMX1L0iu'),
(142, 'PELATIH', 'erwinwina349@gmail.com', '$2b$12$8x/WHjpdSXcV4X24IvtTHui0psWLzotnvsSoJ3zxr9xOT55T9bCo.'),
(143, 'PELATIH', 'innoaditiansyah999@gmail.com', '$2b$12$jnGBzO/30y8B8z.7/HRfHuSP21o23..i6djCIauAOQCmk5p72hal2'),
(144, 'PELATIH', 'alfadmuhamad890@gmail.com', '$2b$12$OWRqJ71DeoVIp8Shw6FAruLmnB/817AHjTzYXR68jQdj7IgDM6D/m'),
(145, 'PELATIH', 'nala.fa00@gmail.com', '$2b$12$J6e74wdyi.WACZdeIIhCDuD4S/qgI/eDsCBj6S5G1sIS5Rl84Hmyi'),
(146, 'PELATIH', 'elfison.8776@gmail.com', '$2b$12$zNs/sjhs33pJCeUqQfIrF.bzkEru5BetV4g5DJgGuUR9nvptTfe92'),
(147, 'PELATIH', 'hendrisupriadi710@gmail.com', '$2b$12$GeAETqlqaWnFcpQ.RnpHouxj32Bq6kkaIQPyqzTvy5V42/1.fx1tq'),
(148, 'PELATIH', 'taekwondosatriayonzikon12@gmail.com', '$2b$12$fBG7bqWJ1lUl3q9MZdj7euqLfiiwV3Hb6uparFCBe3v31NZihj43m'),
(149, 'PELATIH', 'naylaqueenzaa@gmail.com', '$2b$12$P4MkP9CUYHV4jLkVp2t8d.yKCkAOp11mgJqmmrIpAiPP0onPGU/4G'),
(150, 'PELATIH', 'retcbangka@gmail.com', '$2b$12$bzksTMyg8kLOtmOe6KKh4.E/Hw9n60R3.sv17ptvO0xR4SZMkAzIK'),
(151, 'PELATIH', 'bhagastyasnihan@gmail.com', '$2b$12$vw2Bcu6n4Pb8cenJ25J4hOibXle9EjDhm/FWnFgphkvUHrhcCLKwu'),
(152, 'PELATIH', 'ramadika.tkd@gmail.com', '$2b$12$4m9HkaTOOVSnU8/OTBRe5.7IwVon0C3wRXfdp.bz7U5NawHdPymL.'),
(153, 'PELATIH', 'ilyas.maulana01@gmail.com', '$2b$12$CFlcV2pUWjofnLSuby6ZC.bSUzyS48ULF2JpqI.8cunwz1r2GeDhy'),
(154, 'PELATIH', 'baghastyasnihan16@gmail.com', '$2b$12$zcRyv.5BJ7iOffpD5bZpOOsqySgcROSjZ/jA4wh6Iz.mCQDZYfybO'),
(155, 'PELATIH', 'andradoang25@gmail.com', '$2b$12$FRbAhvj2nH7mCUqCV6JSPONcX0Xivk3/2Z6qfONJ8ISPSWf0/FOme'),
(156, 'PELATIH', 'ikdwierizkatkd@gmail.com', '$2b$12$6Q7o5/8iMN2QxJ/V3X3G2eXOsjD5usLUYYPi8HV4TC2sc03HuFM9y'),
(157, 'PELATIH', 'okta110osdy@gmail.com', '$2b$12$T04YfovWsyiGBYD9O0hALOzlHsDBIg2..GQfCBmn0ZdHgyGtsLH6O'),
(158, 'PELATIH', 'hadadarrozi@gmail.com', '$2b$12$kP3UugEA6CwJUup80iXTQORYcVveT3o88bgU4TwOr3BeZ5EqtfEh.'),
(159, 'PELATIH', 'septianpujakusuma23@gmail.com', '$2b$12$J99N3ydjATXDq0I38L46xuApumpYMX7Pcra31hjgNXgLpW5QbHqP6'),
(160, 'PELATIH', 'llgfikri36@gmail.com', '$2b$12$s6AuAvMUCa11o8pg4ZxY3ee.fZXnXuMjkhQSoHyiwWesjai/26n.q'),
(161, 'PELATIH', 'kevin.kennedy888888@gmail.com', '$2b$12$bpB8TOlGvMDylY8UuZ3HqeMrA5uvbmRQTAhSmDgV/ir8onAIdK5VK'),
(162, 'PELATIH', 'ridhoramadhan01@gmail.com', '$2b$12$IaSDlHuj.F67UK0TZYf6/u/kCaD0YJnd/SeMY4LO7f5m.L1wzBTwy'),
(163, 'PELATIH', 'intangemilangmaharani@gmail.com', '$2b$12$BCrlc0cK3F7abCq1qAA9YuXjEGNgjECzdBiVnfyXNm0.ARaXo27n.'),
(164, 'PELATIH', 'jennydestiyani86@gmail.com', '$2b$12$1O0bKiAkxSXjIlVoDlGZF.14GLPvCqKp5LYqt/yiHJR6LgTbTo1HK'),
(165, 'PELATIH', 'abuuoy.okeurai@gmail.com', '$2b$12$gd3l1ohzOhm4yhndZqPD7OW/Q.1wJbnE0gizcJvjLuwHYGceEO/pe'),
(166, 'PELATIH', 'm.rifky22012002@gmail.com', '$2b$12$Iud5X66MjgpSLpiPU442yOJRm0r6AhSZPNNKQcuVzQVAm.7COK88a'),
(167, 'PELATIH', 'winashafiyah@gmail.com', '$2b$12$H73UQ4WtHExBd8EuUXyAB.y24nHe6MBIwwJkOM4u5Y2bqQDhBRQem'),
(168, 'PELATIH', 'dedeknurjamila17@gmail.com', '$2b$12$RYinwcWWnitm97lAdjplj.xoygZztfVPw6c3eYLw84HuoArkrLgkG'),
(169, 'PELATIH', 'yanapuspita15@gmail.com', '$2b$12$tOVrksYInEj4A69PNvfFG.MBUxCFc3ngr5YkDssEktXGFueiOkCuK'),
(170, 'PELATIH', 'barry.amanullah19@gmail.com', '$2b$12$NTYtdpMzhExXeItXvjONVugiHLKCqb9KS4Q.IhPDVP13KDkc3SoIa'),
(171, 'PELATIH', 'fikrisaputra123456@gmail.com', '$2b$12$Jo5iLmjo2osRyIgDxgU1N.bEjQDaaFpfdYOscR3pNO/6jioExRUUW'),
(172, 'PELATIH', 'elhammuhardi06@gmail.com', '$2b$12$PDFx6f5biRCxZmI2Wftqc.jHtHmaRYlZqW.8BNPWgn82HMkPyN3Fy'),
(173, 'PELATIH', 'taekwondolampungutara@gmail.com', '$2b$12$abWo6h0yMdc3WKkJ8ECfc.9xK6hMKEoLwmiDhDNtBG9LhfgnyiMve'),
(174, 'PELATIH', 'alkhazim1112@gmail.com', '$2b$12$lIhn3r1VBa2TX35jLqUJGeDHqJtMMrMzudS5uHvgsV7djJWHbON4i'),
(175, 'PELATIH', 'tkdfalciorkarigamas@gmail.com', '$2b$12$n6ZOXhGS/aTmMs6boZWNxOBhF79iPwtp1q.nHtqSGfql8x.gQc/AO'),
(176, 'PELATIH', 'bungatree6@gmail.com', '$2b$12$hAH0Js0apPpGQAH/htx9aurzBiP/Za1kwQZSFRR7addYcDYNSHWYe'),
(177, 'PELATIH', 'heromeizho788@gmail.com', '$2b$12$oX056b6LsEi.Q4.tGgR9UOS7IjL8Y3KkJY83t0fxOmLQJHjco3Kfq'),
(178, 'PELATIH', 'syukrimz@gmail.com', '$2b$12$cY29F6Shp4Ct6z6G5.Ez2eYeekpmZcopA5x6uy.LslCslm8azjRDi'),
(179, 'PELATIH', 'ridwanyuyun123@gmail.com', '$2b$12$I3Bebt8EobGewWqm5ZMeb.DshNCsn..mrbHu4JDTE/3xb7Dow2PzS'),
(180, 'PELATIH', 'riyantovalent09@gmail.com', '$2b$12$uh05MGR6/M1yHzHfsim5pe0kNWORXZhz7RBRetmKcb4OjBduE5/Ea'),
(181, 'PELATIH', 'mgsdimas21@gmail.com', '$2b$12$jgPzClcXHbP3LDSAeYj/UO1U7FOx5drQYloOYD2rtyRx7QtgSbh.u'),
(182, 'PELATIH', 'farrahdante30@gmail.com', '$2b$12$Lh5ps8lzIdFnwfIWEXY/zeID1yA4ZSlLRsk36xOIQWwOLb/Enjm.i'),
(183, 'PELATIH', 'taekwondolampung845@gmail.com', '$2b$12$9qITxlFjSGftAETLs8WJJeornSwc2TeDJxrMlBpnTRJdb6BYwYjje'),
(184, 'PELATIH', 'syageriharyadika@gmail.com', '$2b$12$ABlzelDWFvREAdfAuxY/GOK93oaddseobfv1McdP.eouDuBeNbaoO'),
(185, 'PELATIH', 'firmansaputra814@gmail.com', '$2b$12$YtjRMS4SDTR/DowocY3GFOwddtx0xJ8JjO3rh5Va2hTqUpzjF7al.'),
(186, 'PELATIH', 'auliawulansari2408@gmail.com', '$2b$12$KCDUNRl23GrRp2lsdL3t0el08JiZG2IrTiSmuEUYGzGmzyDMZnmyK'),
(187, 'PELATIH', 'ahmadhongki.ah29@gmail.com', '$2b$12$.PWp6tqjjhlL7XLas84stOh2nssL8ZEsP3PMDOipyvCOLLxooTMRO'),
(188, 'PELATIH', 'mardi07021979@gmail.com', '$2b$12$Veiy12Al7lnRUP60gfUzfOdcr1pEhpB3TnshNX9W9dZzGGayj/YYG'),
(189, 'PELATIH', 'abdulmujibdkd@gmail.com', '$2b$12$aYK7DFZoDM5J/PXmoG1SP.PvliIbVwELmCBfDTbHYIVVH1SXlhdeC'),
(190, 'PELATIH', 'jayataekwondoclub19@gmail.com', '$2b$12$8wWXE40xDW8Vee8Vr9FnUuxvnn9gqkiBR76TyjQcn2wlLREbvmEgu'),
(191, 'PELATIH', 'rafiqahrmu@gmail.com', '$2b$12$CUIkQhdMHePCMwJvMSkL9un/uk.sRGIpZXIxk..lO1qWA9yi4AoA.'),
(192, 'PELATIH', 'fm4402558@gmail.com', '$2b$12$P9A.1P3Npyvc8lcErZCW5ewxT8dfG65L3ePL6vwxAzzO2yPYPoXFe'),
(193, 'PELATIH', 'wikijefri01@gmail.com', '$2b$12$JOPUpUpM2x8Rg696T4NC2OGixVaMdccfVRdM.sr85AfXo87WX2VMe'),
(194, 'PELATIH', 'taekwondogaruda.1@gmail.com', '$2b$12$zMn6uv3mnOwmaoLl1glHf.e/dVucspPg1gId5tCy2Bwfgovn95MDO'),
(195, 'PELATIH', 'helmiedisaspn@gmail.com', '$2b$12$RS26oQp.ddbRjTyZ6c512.SGBbZSyu2v7pxgmsj9IjD2Kq6dHXcYC'),
(196, 'PELATIH', 'arjunaajaa361@gmail.com', '$2b$12$XIvEFjCWV6ka31lIsDGSauKl1GsLbLVchtoLA1zo00JjpqH3cXnkW'),
(197, 'PELATIH', 'jusmiatielok@gmail.com', '$2b$12$8CyueCNuxbNCNbScBRFSZe9esO8U31fGVYoqEkjsIIaAD7Bh3wGIG'),
(198, 'PELATIH', 'ratihyustikasari33@gmail.com', '$2b$12$hONcFrw4FC4fP0uJ0VdPceslXkYegOJatogVcH9wQPl1d/bJvo1Xe'),
(199, 'PELATIH', 'yediangel2@gmail.com', '$2b$12$Hkl.jwW9NhcmBUky.EACE.wnZ.2B6Si8/f8naxpCeoloj7ksTiyj6'),
(200, 'PELATIH', 'debymardianto30@gmail.com', '$2b$12$DwjEvqzUdTFJ8PEd2ncMmOsX5Lf6DOIp.V31phWJZ8lJzLqmNdvGi'),
(201, 'PELATIH', 'saskiajenita19@gmail.com', '$2b$12$rx91vGxZq5qF1vSuBkl5wOanPSOfEAPYlsDf2IkSLOWLJe/j9b5Ve'),
(202, 'PELATIH', 'balqisnamira11@gmail.com', '$2b$12$HYuwHXdXvNluVG8kFGw6FeMdwVkiG8v1vTuonGoVMuc5ZXkTdIQ2K'),
(203, 'PELATIH', 'adnankhadafiramadon@gmail.com', '$2b$12$LhAMnNP3yqX8bd3zFeZWXe3UCutybHq200/qIn8B6Iju94NxOyH5C'),
(204, 'PELATIH', 'novri021186@gmail.com', '$2b$12$2UQO4MEjtlATeFXurA6.Z.Dp.uAcoLKM.g53R9gAGabU/HVtF.UXu'),
(205, 'PELATIH', 'titoferdianth92@gmail.com', '$2b$12$tkmxQSDAT94xHO3e635cD.VNPKOSAfdkUoe9zn/DSY7oUk1tRZVMe'),
(206, 'PELATIH', 'aldavaramadika.tkd@gmail.com', '$2b$12$iCNcVH5w5/U2zmYDZtW3cOigsFceFyQorrd/erzz.6/PI/9lj9sby'),
(207, 'PELATIH', 'forevertaekwondoacademy@gmail.com', '$2b$12$jvwMeGDlRkfrO4amvf2tTep9Zb9dOYKgczu5.PxflKFQZJOI1vyqu'),
(208, 'PELATIH', 'jibrilzafril2@gmail.com', '$2b$12$30OupE8gBpCMHw8mYIipDemF.rjAvicUfnfQz5.Ik58PCCtUntKf.'),
(209, 'PELATIH', 'faristriamansyh.1@gmail.com', '$2b$12$lQEJBtePnGur87rfkekwM.0kvs8.4tw1woodUuppJshsRKLx2SMLu'),
(210, 'PELATIH', 'elthonbonietampubolon@gmail.com', '$2b$12$GWjbI6aXdAzN7LEYLGUM7e7dx6yeFeE5phLcJo3EIj79ssPFQGzra'),
(211, 'PELATIH', 'diyanazhe2100@gmail.com', '$2b$12$IJbdVkwzJKRPckDPRqro/ejyZ6MoU5YyYefTT9oj3GraPwMAXynxi'),
(212, 'PELATIH', 'doniprasetio613@gmail.com', '$2b$12$KCdF77Nh.ssSUm1/3BCpL.tduGA.KlO7xEti/m2pUbOgtuFSe9qO2'),
(213, 'PELATIH', 'berylauren00@gmail.com', '$2b$12$IuiqcT0ZO1lqzLu5NzyKEu7/vMFPY0PLLkCLIjCDrvTmdgLnmFmoG'),
(214, 'PELATIH', 'deswiantosasputra@gmail.com', '$2b$12$tvg/0kcSNCmXosQ0IJ2jh.qokaqKd8KipPTYFRF93PtUzuSufnWMu'),
(215, 'PELATIH', 'dzakyeky23@gmail.com', '$2b$12$l1A4QPN6p05cvdKMyPzRbODz8cwW8zzS611.SfBp41kqNgB8AkRW.'),
(216, 'PELATIH', 'patookpatook96@gmail.com', '$2b$12$evNCcq9WLvltNROiYb4VJeVd39Cv/lnha0LvDxkWENxvjt17oz/46'),
(217, 'PELATIH', 'armando140510@gmail.com', '$2b$12$tdZjLHao6C8pCKVMpgbYg.vkrZaBW.pe4.0WpBS8GgmrbeMrbYQ/O'),
(218, 'PELATIH', 'ahdantap@gmail.com', '$2b$12$OD1Lo8xY/H5SJ/oW6o.NAO3YBdmyUygqu3o3aGHjpDoJUCu4EO2nK'),
(219, 'PELATIH', 'sayangnenek7@gmail.com', '$2b$12$qGR5eEwGtxP6byXpo2WlJOyGBKtn1Mx/O8XQnaQN7r1Iia3smhDCq'),
(220, 'PELATIH', 'sur72nto.sy@gmail.com', '$2b$12$zR8i3aNsYHp8p5R.nrXBW.zKZaei.L5J03QCA62tEb2pF.FmPAgZ.'),
(221, 'PELATIH', 'delete@gmail.com', '$2b$12$UONez3FQvg/R4zvfS5qgye.1tkot.k6VrgNTrMoJKsRKm8DM3a6YG'),
(222, 'PELATIH', 'tesdelete@gmail.com', '$2b$12$zlSpgFuBLAqWgWjcZZ29NeYGNFNI.P.2aecoyZVRsloEvKk5KVT5K'),
(223, 'PELATIH', 'scorpiontaekwondo75@gmail.com', '$2b$12$h/wNrqBaVrr8Y3P8UF.JY.431hoSx4C6fh.AfKDSYno0rCeu8S7aG'),
(224, 'PELATIH', 'delete@example.com', '$2b$12$pwaeXjngMJ4gng/KXbL54uTBzkXw7PXQB1ScfOyl8OIajYlB/KA62'),
(225, 'PELATIH', 'inilogin@gmail.com', '$2b$12$p02oEns.h.ryY9ckLMSkDuf5kxSpZ/zkCWW.37gyILzdk.wt4.D.O'),
(226, 'PELATIH', 'jovivernando72@gmail.com', '$2b$12$iNKw/n/hF1ddftTeEQCTwuinEevn7grBfu1UwyBU7octDl7N4Iawm'),
(227, 'PELATIH', 'asmatdaranading@gmail.com', '$2b$12$Cp8r8JjBWzgQzX81nJzJeOkLrTNp4b60QtzH4Mn3t.O1jyfLasale'),
(228, 'PELATIH', 'jayadiyadijayadi123@gmail.com', '$2b$12$ibZf/dynUx5Zbo477xcNv.Bc99gOe49KX2b7hs/725elj943xMs9W'),
(229, 'PELATIH', 'rudiwesesa@gmail.com', '$2b$12$ly4LsItmIgupxiWnDzpIGun8VCpmbNiPxxEmlyr1cfQuA4AwVMdn6'),
(230, 'PELATIH', 'syageryharyadika@gmail.com', '$2b$12$K17bK8lVGl7kllsnZ0HUqeiMNfktU6zIp/LucPRbSX4yKbTVHhkYO'),
(231, 'PELATIH', 'shndra172@gmail.com', '$2b$12$/DPT1ZpZfE3bKXNfFBRwU.Z.5wtYY2.XTuF5mcyaBn16a.8Wk7lre'),
(232, 'PELATIH', 'danikurniawan@gmail.com', '$2b$12$rsMKkkW/BkGIrYjtUawqmufHZOmehSf9MLf32ENrNH60yihEQ3U9e'),
(233, 'PELATIH', 'tapahtaekwondoacademy@gmail.com', '$2b$12$UCaMDpBVYWXmot44seSWxuaIEshQUbfP4yp2YdWBeDQMobNcT18T6'),
(234, 'PELATIH', 'okiburhan1983@gmail.com', '$2b$12$fji1yvUpYyfXhaE5PhznLO50R/5IyZj3RsVwgI9XNIipmY4hBFJ7S'),
(235, 'PELATIH', 'jojo.nathan08112@gmail.com', '$2b$12$9J8Y3S6ASt6nYL8.hAdaPegtm3DY4Ce8vJsrGhbDsNcri5baCHsoq'),
(236, 'PELATIH', 'brodonrmadon@gmail.com', '$2b$12$K170y3lhUXc97NFYArqjW.wpeLMFHzBvDbOx4UaF8TeHi4LWB8YEu'),
(237, 'PELATIH', 'alisagery13@gmail.com', '$2b$12$L82MLIAShAeIesmwBo0HhOb2bTwbuBG0JdDU4T961zrnqKJk.nsZ.'),
(238, 'PELATIH', 'sitinrhdyh30@gmail.com', '$2b$12$GENgThttATFQYPO2nfHR1.Z5UA4aIm5ijXhgc4Mjrd0L0xFZXWGdS'),
(239, 'PELATIH', 'jinggaseptiasadevita@gmail.com', '$2b$12$R37TyUbWIIZQS.TLLUop1.l1AZYkJ98L2LGxjDRRZ64FcsJ88yQjG'),
(240, 'PELATIH', 'bunga.jambi2021ed@gmail.com', '$2b$12$TjOyXjYCGM5QaYINBFGGMey0/700KAa9BO62Atvb490CeIjLYmL0O'),
(241, 'PELATIH', 'mrdho360@gmail.com', '$2b$12$5HK/nbNzeRCjXlYgUbW4VOLzarV8ikYOG.r9pZPnk2gfzXxo7GNrq'),
(242, 'PELATIH', 'm.ibnusina2010@gmail.com', '$2b$12$8qXTIqzrIkypRbfXpGUlVebAg03DFWuXUTZU77lDKPUkm7I5fyOia'),
(243, 'PELATIH', 'cvratama@gmail.com', '$2b$12$8caZ4P.BYFT2xkpCinPbp.tQOti82lvNSK2y2tB7q.jK14.JBkjrK'),
(244, 'PELATIH', 'alghurobateampalembang@gmail.com', '$2b$12$Xcz59kTe4FhcQC2xL4UXPOwHZXphXkzT3n5j/LUXt/g2jQWIthSNi');

-- --------------------------------------------------------

--
-- Table structure for table `tb_antrian`
--

CREATE TABLE `tb_antrian` (
  `id_antrian` int(11) NOT NULL,
  `id_lapangan` int(11) NOT NULL,
  `bertanding` int(11) NOT NULL,
  `persiapan` int(11) NOT NULL,
  `pemanasan` int(11) NOT NULL
) ENGINE=InnoDB DEFAULT CHARSET=utf8mb4 COLLATE=utf8mb4_unicode_ci;

--
-- Dumping data for table `tb_antrian`
--

INSERT INTO `tb_antrian` (`id_antrian`, `id_lapangan`, `bertanding`, `persiapan`, `pemanasan`) VALUES
(8, 39, 1, 2, 3),
(9, 42, 3, 4, 5),
(10, 41, 52, 53, 54),
(11, 44, 59, 60, 61),
(12, 40, 56, 57, 58),
(13, 43, 26, 27, 28),
(14, 47, 2, 3, 4),
(15, 46, 20, 21, 22),
(16, 45, 31, 32, 33),
(17, 51, 0, 0, 0),
(18, 50, 0, 0, 0),
(19, 49, 56, 57, 58),
(20, 48, 50, 51, 52),
(21, 56, 0, 0, 0),
(22, 55, 0, 0, 0),
(23, 52, 0, 0, 0),
(24, 54, 55, 56, 57),
(25, 53, 58, 59, 60),
(26, 59, 57, 58, 59),
(27, 58, 39, 40, 41),
(28, 57, 3, 4, 5),
(29, 61, 0, 0, 0),
(30, 60, 0, 0, 0),
(31, 62, 0, 0, 0),
(34, 70, 0, 0, 0);

-- --------------------------------------------------------

--
-- Table structure for table `tb_atlet`
--

CREATE TABLE `tb_atlet` (
  `id_atlet` int(11) NOT NULL,
  `nama_atlet` varchar(150) NOT NULL,
  `tanggal_lahir` datetime(3) NOT NULL,
  `berat_badan` double NOT NULL,
  `tinggi_badan` double NOT NULL,
  `jenis_kelamin` enum('LAKI_LAKI','PEREMPUAN') NOT NULL,
  `id_dojang` int(11) NOT NULL,
  `id_pelatih_pembuat` int(11) NOT NULL,
  `akte_kelahiran` varchar(255) DEFAULT NULL,
  `pas_foto` varchar(255) DEFAULT NULL,
  `sertifikat_belt` varchar(255) DEFAULT NULL,
  `ktp` varchar(255) DEFAULT NULL,
  `kota` varchar(100) DEFAULT NULL,
  `provinsi` varchar(100) NOT NULL,
  `umur` int(11) DEFAULT NULL,
  `alamat` varchar(191) DEFAULT NULL,
  `belt` varchar(191) NOT NULL,
  `nik` varchar(191) NOT NULL,
  `no_telp` varchar(191) DEFAULT NULL
) ENGINE=InnoDB DEFAULT CHARSET=utf8mb4 COLLATE=utf8mb4_unicode_ci;

--
-- Dumping data for table `tb_atlet`
--

INSERT INTO `tb_atlet` (`id_atlet`, `nama_atlet`, `tanggal_lahir`, `berat_badan`, `tinggi_badan`, `jenis_kelamin`, `id_dojang`, `id_pelatih_pembuat`, `akte_kelahiran`, `pas_foto`, `sertifikat_belt`, `ktp`, `kota`, `provinsi`, `umur`, `alamat`, `belt`, `nik`, `no_telp`) VALUES
(1, 'Budi Santoso', '2012-05-15 00:00:00.000', 35, 145, 'LAKI_LAKI', 1, 1, 'akte_budi.pdf', 'atlet_1_pas_foto_1758961372034.jpeg', 'belt_budi.pdf', 'atlet_1_ktp_1758961435701.png', 'Bandung', 'Jawa Barat', 13, NULL, 'kuning', '3201012012110001', NULL),
(2, 'Siti Rahma', '2011-08-20 00:00:00.000', 32, 142, 'PEREMPUAN', 1, 1, 'akte_siti.pdf', 'siti.jpg', 'belt_siti.pdf', NULL, 'Bandung', 'Jawa Barat', 12, NULL, 'hijau', '3201012011110002', NULL),
(3, 'Ahmad Fajar', '2008-03-10 00:00:00.000', 58, 168, 'PEREMPUAN', 1, 1, 'atlet_1_akte_kelahiran_1758053955188.png', 'atlet_1_pas_foto_1758053955189.png', 'belt_ahmad.pdf', 'atlet_1_ktp_1758053955189.png', 'Muaro Jambi', 'Jambi', 17, 'JL. Tegal Parang', 'kuning', '3201012008080003', '1820192891212'),
(4, 'Dewi Putri', '2007-11-25 00:00:00.000', 49, 160, 'PEREMPUAN', 1, 1, 'akte_dewi.pdf', 'dewi.jpg', 'belt_dewi.pdf', NULL, 'Bandung', 'Jawa Barat', 16, NULL, 'merah', '3201012007070004', NULL),
(5, 'Rudi Hermawan', '2005-04-30 00:00:00.000', 68, 175, 'LAKI_LAKI', 1, 1, 'akte_rudi.pdf', 'rudi.jpg', 'belt_rudi.pdf', NULL, 'Bandung', 'Jawa Barat', 20, NULL, 'hitam', '3201012005050005', NULL),
(6, 'Maya Sari', '2004-07-15 00:00:00.000', 57, 165, 'PEREMPUAN', 1, 1, 'akte_maya.pdf', 'maya.jpg', 'belt_maya.pdf', NULL, 'Bandung', 'Jawa Barat', 21, NULL, 'hitam', '3201012004040006', NULL),
(7, 'Doni Kusuma', '2003-09-20 00:00:00.000', 80, 180, 'LAKI_LAKI', 1, 1, 'akte_doni.pdf', 'doni.jpg', 'belt_doni.pdf', NULL, 'Bandung', 'Jawa Barat', 22, NULL, 'hitam', '3201012003030007', NULL),
(8, 'Linda Wati', '2002-12-05 00:00:00.000', 62, 167, 'PEREMPUAN', 1, 1, 'akte_linda.pdf', 'linda.jpg', 'belt_linda.pdf', NULL, 'Bandung', 'Jawa Barat', 23, NULL, 'hitam', '3201012002020008', NULL),
(9, 'Rizki Pratama', '2001-02-28 00:00:00.000', 74, 178, 'LAKI_LAKI', 1, 1, 'akte_rizki.pdf', 'rizki.jpg', 'belt_rizki.pdf', NULL, 'Bandung', 'Jawa Barat', 24, NULL, 'hitam', '3201012001010009', NULL),
(10, 'asasd', '2000-06-15 00:00:00.000', 53, 163, 'PEREMPUAN', 1, 1, 'akte_anisa.pdf', 'atlet_1_pas_foto_1758051280754.png', 'belt_anisa.pdf', 'atlet_1_ktp_1758051335289.png', 'Bandung', 'Jawa Barat', 25, NULL, 'hitam', '3201012000000010', '0812123020192'),
(12, 'Marvin', '2004-02-23 00:00:00.000', 70, 167, 'LAKI_LAKI', 1, 1, 'atlet_1_akte_kelahiran_1757510276889.png', NULL, NULL, NULL, 'Batam', 'Kepulauan Riau', 21, 'Jl. Hasajsajsao', 'hitam3', '9820981918231313', '0821727161'),
(18, 'Rezik alviro javier utomo', '2012-06-08 00:00:00.000', 73, 156, 'LAKI_LAKI', 4, 6, 'atlet_6_akte_kelahiran_1758084418742.jpg', 'atlet_6_pas_foto_1758084418748.jpg', 'atlet_6_sertifikat_belt_1758084418752.jpg', NULL, 'Jambi', 'Jambi', 13, 'Jl. Dr siwabessy rt 15', 'hijauBiru', '1571010806120003', '081373861729'),
(19, 'Arumi nasha', '2016-07-31 00:00:00.000', 32, 132, 'PEREMPUAN', 4, 6, 'atlet_6_akte_kelahiran_1758085774497.jpg', 'atlet_6_pas_foto_1758085774502.jpg', 'atlet_6_sertifikat_belt_1758085774505.jpg', NULL, 'Jambi', 'Jambi', 9, 'Jl yulius usman rt 18 pematang sulur', 'hijauBiru', '1571017107160001', '085279141612'),
(20, 'Muhammad farid atallah', '2014-11-13 00:00:00.000', 30, 132, 'LAKI_LAKI', 4, 6, 'atlet_6_akte_kelahiran_1758100654027.jpg', 'atlet_6_pas_foto_12-11-2025_08.51.webp', 'atlet_6_sertifikat_belt_1758100654037.jpg', NULL, 'Jambi', 'Jambi', 11, 'Jl dr siwabessy rt 2 buluran kenali', 'hijauBiru', '1571011311140001', '082377791987'),
(21, 'Lulu nafisah athilah', '2019-05-28 00:00:00.000', 23, 115, 'PEREMPUAN', 4, 6, 'atlet_6_akte_kelahiran_1758093169024.jpg', 'atlet_6_pas_foto_12-11-2025_08.57.jpg', 'atlet_6_sertifikat_belt_1758093169037.jpg', NULL, 'Jambi', 'Jambi', 6, 'Jl.dr siwabessy rt 2 buluran kenali', 'kuning', '1571016805190001', '082377791987'),
(22, 'Arvino ahmad fahreza', '2018-05-01 00:00:00.000', 19, 118, 'LAKI_LAKI', 4, 6, 'atlet_6_akte_kelahiran_1758091042096.jpg', 'atlet_6_pas_foto_1758091042103.jpg', 'atlet_6_sertifikat_belt_1758091042108.jpg', NULL, 'Jambi', 'Jambi', 7, 'Perum griya raya 3 rt 3 pematang sulur', 'kuning', '1501020105180001', '082278226540'),
(23, 'Kayyisa mazea zalierda', '2012-05-26 00:00:00.000', 53.9, 161, 'PEREMPUAN', 4, 6, 'atlet_6_akte_kelahiran_1758092000432.jpg', 'atlet_6_pas_foto_12-11-2025_08.46.jpg', 'atlet_6_sertifikat_belt_1758092000438.jpg', NULL, 'Jambi', 'Jambi', 13, 'Perum indoguna rawasari', 'hijauBiru', '1171026605120001', '085210242020'),
(24, 'Erzu aprilino zada', '2014-04-24 00:00:00.000', 32.3, 143, 'LAKI_LAKI', 4, 6, 'atlet_6_akte_kelahiran_1758091339170.jpg', 'atlet_6_pas_foto_12-11-2025_08.39.jpg', 'atlet_6_sertifikat_belt_1758091339180.jpg', NULL, 'Jambi', 'Jambi', 11, 'Perum indoguna rawasari jambi', 'merah', '1171022404140001', '085210242020'),
(25, 'M.raya al riqky perdana', '2011-04-26 00:00:00.000', 61, 158, 'LAKI_LAKI', 4, 6, 'atlet_6_akte_kelahiran_1758096780551.jpg', 'atlet_6_pas_foto_1758096780557.jpg', NULL, NULL, 'Jambi', 'Jambi', 14, 'Perumnas kenali kota baru', 'putih', '1571012604110021', '085268891186'),
(26, 'Muhammad abdur roosyid', '2015-11-06 00:00:00.000', 34, 131, 'LAKI_LAKI', 4, 6, 'atlet_6_akte_kelahiran_1758098655354.jpg', 'atlet_6_pas_foto_1758098655358.jpg', 'atlet_6_sertifikat_belt_1758098655361.jpg', NULL, 'Jambi', 'Jambi', 9, 'Lorong keluarga rt 10 buluran kenali', 'hijau', '1571010611150004', '085266131486'),
(27, 'Muhamad ahza pratama', '2012-01-31 00:00:00.000', 60, 159, 'LAKI_LAKI', 4, 6, 'atlet_6_akte_kelahiran_1758098236694.jpg', 'atlet_6_pas_foto_1758098236701.jpg', 'atlet_6_sertifikat_belt_1758098236704.jpg', NULL, 'Jambi', 'Jambi', 13, 'Jl.kaca piring 1 rt 29', 'hijauBiru', '1571013101120001', '081270360690'),
(29, 'Muhamad afif firdaus', '2015-12-10 00:00:00.000', 26.1, 133, 'LAKI_LAKI', 4, 6, 'atlet_6_akte_kelahiran_1758097424670.jpg', 'atlet_6_pas_foto_1758097424675.jpg', 'atlet_6_sertifikat_belt_1758097424678.jpg', NULL, 'Jambi', 'Jambi', 9, 'Jl.kaca piring 1 rt 29', 'hijauBiru', '1571011012150001', '081270360690'),
(30, 'Alychia hafidzah siswanto', '2018-11-18 00:00:00.000', 18, 112, 'PEREMPUAN', 4, 6, 'atlet_6_akte_kelahiran_1758085689194.jpg', 'atlet_6_pas_foto_12-11-2025_08.36.jpg', 'atlet_6_sertifikat_belt_1758085689201.jpg', NULL, 'Jambi', 'Jambi', 7, 'Jl depati parbo rt 16 pematang sulur', 'kuning', '1571105811180001', '085236166461'),
(31, 'Muhammad ridho hafiz siswanto', '2015-12-20 00:00:00.000', 41, 145, 'LAKI_LAKI', 4, 6, 'atlet_6_akte_kelahiran_1758101042686.jpg', 'atlet_6_pas_foto_12-11-2025_09.01.jpg', 'atlet_6_sertifikat_belt_1758101042694.jpg', NULL, 'Jambi', 'Jambi', 10, 'Jl depati parbo rt 16 pematang sulur', 'hijau', '1571012012150002', '085236166461'),
(32, 'Fatir ali musaddiq', '2013-11-11 00:00:00.000', 40.8, 147, 'LAKI_LAKI', 4, 6, 'atlet_6_akte_kelahiran_1758091575790.jpg', 'atlet_6_pas_foto_1758091575794.jpg', 'atlet_6_sertifikat_belt_1758091575795.jpg', NULL, 'Jambi', 'Jambi', 11, 'Jl sersan anwar lorong pasundan rt 26', 'hijauBiru', '1571071111130008', '081272661234'),
(33, 'Muhammad fadhil al faeyza', '2014-08-11 00:00:00.000', 33, 143, 'LAKI_LAKI', 4, 6, 'atlet_6_akte_kelahiran_1758099729512.jpg', 'atlet_6_pas_foto_1758099729517.jpg', 'atlet_6_sertifikat_belt_1758099729522.jpg', NULL, 'Jambi', 'Jambi', 11, 'Jl patimura perum grand slamet kenali besar', 'kuning', '1571071108040102', '081366195079'),
(34, 'Raqilla rynanda elmadina', '2018-10-20 00:00:00.000', 38, 125, 'PEREMPUAN', 4, 6, 'atlet_6_akte_kelahiran_1758101563939.jpg', 'atlet_6_pas_foto_12-11-2025_09.02.jpg', 'atlet_6_sertifikat_belt_1758101563951.jpg', NULL, 'Jambi', 'Jambi', 7, 'Perum griya raya 3 pematang sulur', 'kuning', '1571016010180003', '085609048818'),
(35, 'Muzzammil Ammar Adenta', '2017-09-02 00:00:00.000', 20.7, 123, 'LAKI_LAKI', 10, 11, 'atlet_11_akte_kelahiran_1757598199806.jpeg', 'atlet_11_pas_foto_1757598199808.jpeg', 'atlet_11_sertifikat_belt_1757598199809.jpeg', 'atlet_11_ktp_1758261794378.jpg', 'Jambi', 'Jambi', 8, 'Jln. Purnama, RT. 16, No. 01', 'hijau', '1571070209170002', '081257800886'),
(36, 'M. Omer Qaiser Bafadhal', '2016-03-15 00:00:00.000', 45, 138, 'LAKI_LAKI', 10, 11, 'atlet_11_akte_kelahiran_1757598688669.jpeg', 'atlet_11_pas_foto_1757598688670.jpeg', 'atlet_11_sertifikat_belt_1757598688670.jpeg', 'atlet_11_ktp_1758105235402.jpeg', 'Jambi', 'Jambi', 9, 'RT. 06, Desa Sumber Jaya', 'hijau', '1571041503160001', '081370041800'),
(49, 'Fauzan Fajrie Pranandito', '2002-03-19 00:00:00.000', 63, 179, 'LAKI_LAKI', 12, 14, 'atlet_14_akte_kelahiran_1757633180116.jpg', 'atlet_14_pas_foto_1757633180116.jpg', 'atlet_14_sertifikat_belt_1757633180117.jpeg', 'atlet_14_ktp_1757633180118.jpg', 'Bogor', 'Jawa Barat', 23, 'Cibubur', 'hitam2', '2222222222222222', '081288857363'),
(50, 'Natahuma Alkalabi', '2010-04-15 00:00:00.000', 70, 170, 'LAKI_LAKI', 10, 11, 'atlet_11_akte_kelahiran_1758262073738.jpeg', 'atlet_11_pas_foto_1758262073739.jpg', 'atlet_11_sertifikat_belt_1758262073742.jpeg', 'atlet_11_ktp_1758262073743.jpeg', 'Jambi', 'Jambi', 15, 'Perumahan Rawasari Permai, No. 77', 'putih', '1571011504100002', '085367664894'),
(51, 'Izyan Muhammad Parsa', '2012-03-31 00:00:00.000', 51, 175, 'LAKI_LAKI', 10, 11, 'atlet_11_akte_kelahiran_1758104902946.jpg', 'atlet_11_pas_foto_1758104902950.jpg', 'atlet_11_sertifikat_belt_1758104902952.jpg', 'atlet_11_ktp_1758104998338.jpg', 'Jambi', 'Jambi', 13, 'Jln. Bangau IV', 'biru', '1571023103120041', '085266033547'),
(52, 'Muhammad Haikal Eshanny', '2011-08-24 00:00:00.000', 47, 159, 'LAKI_LAKI', 10, 11, 'atlet_11_akte_kelahiran_1758261555160.jpg', 'atlet_11_pas_foto_1758261555163.jpg', 'atlet_11_sertifikat_belt_1758261555164.jpg', 'atlet_11_ktp_1758261555168.jpg', 'Jambi', 'Jambi', 14, 'Komp. Vila Kenali, RT. 027', 'kuning', '1503032408110001', '085384129122'),
(53, 'M. Archi Barru Alfattaah', '2016-04-22 00:00:00.000', 40, 142, 'LAKI_LAKI', 10, 11, 'atlet_11_akte_kelahiran_1758262765434.jpg', 'atlet_11_pas_foto_1758261313011.jpeg', 'atlet_11_sertifikat_belt_1758262765436.jpg', 'atlet_11_ktp_1758262765440.jpg', 'Jambi', 'Jambi', 9, 'Jln. Jendral A. Thalib, RT. 025', 'hijauBiru', '1571012204160001', '085367664894'),
(54, 'Shaka Kirana Salama', '2016-03-18 00:00:00.000', 60, 148, 'LAKI_LAKI', 10, 11, 'atlet_11_akte_kelahiran_1758262257669.jpg', 'atlet_11_pas_foto_1758262257673.jpg', 'atlet_11_sertifikat_belt_1758262257674.jpg', 'atlet_11_ktp_1758262257676.jpg', 'Jambi', 'Jambi', 9, 'Jln. Mayor A. Marzuki, No. 58', 'kuningHijau', '1571071803160001', '082333186599'),
(55, 'Baihaqi Ibrahim', '2014-06-07 00:00:00.000', 43, 140, 'LAKI_LAKI', 10, 11, 'atlet_11_akte_kelahiran_1758104682375.jpg', 'atlet_11_pas_foto_1758104682377.jpg', 'atlet_11_sertifikat_belt_1758104682378.jpg', 'atlet_11_ktp_1758896812426.jpg', 'Jambi', 'Jambi', 11, 'Jln. M. Kukuh, Perum. Golden Hill, Kotabaru', 'hijau', '1571070706140003', '085269739229'),
(56, 'ATHAFARIZ ZIKI REGINTANG', '2017-02-27 00:00:00.000', 30, 132, 'LAKI_LAKI', 16, 18, 'atlet_18_akte_kelahiran_1758976730323.png', 'atlet_18_pas_foto_1758976730326.jpeg', 'atlet_18_sertifikat_belt_1758976730326.png', NULL, 'Ogan Komering Ulu Timur', 'Sumatera Selatan', 8, 'Jl. Griya Praja Permai, Kotabaru Selatan', 'biru', '1608012702170002', '081379888061'),
(57, 'RENATA AGUSTIN', '2014-08-18 00:00:00.000', 28.2, 137, 'PEREMPUAN', 19, 22, 'atlet_22_akte_kelahiran_1757748132731.pdf', 'atlet_22_pas_foto_1757748132733.jpg', 'atlet_22_sertifikat_belt_1757748132742.pdf', NULL, 'Jambi', 'Jambi', 11, 'Jln prabusiliwangi 024 tanjung sari jambi timur kota jambi', 'kuning', '1571035808140001', '089616105566'),
(58, 'RIZKI ALVINO', '2016-05-07 00:00:00.000', 26, 130, 'LAKI_LAKI', 19, 22, 'atlet_22_akte_kelahiran_1757748586553.pdf', 'atlet_22_pas_foto_1757748586554.jpg', 'atlet_22_sertifikat_belt_1757748586561.jpg', NULL, 'Jambi', 'Jambi', 9, 'Jln. Prabusiliwangi 024 tanhung sari jambi timur', 'kuningHijau', '1571030705160004', '089616105566'),
(59, 'ERICO DITA APRILIAN', '2008-04-06 00:00:00.000', 66.5, 165, 'LAKI_LAKI', 19, 22, 'atlet_22_akte_kelahiran_1757748876535.jpg', 'atlet_22_pas_foto_1757748876543.jpg', 'atlet_22_sertifikat_belt_1757748876547.jpg', 'atlet_22_ktp_04-11-2025_18.02.jpg', 'Jambi', 'Jambi', 17, 'Jln. Prabusiliwangi 025 tanjung sari jambi timur', 'kuningHijau', '1571030604080061', '089616105566'),
(60, 'ERIDO', '2008-05-12 00:00:00.000', 51, 161, 'LAKI_LAKI', 19, 22, 'atlet_22_akte_kelahiran_1757750152696.jpg', 'atlet_22_pas_foto_1757750152703.jpg', 'atlet_22_sertifikat_belt_1757750152708.jpg', 'atlet_22_ktp_04-11-2025_17.47.jpg', 'Jambi', 'Jambi', 17, 'Jln. Prabusiliwangi RT 22', 'kuningHijau', '1571031205080001', '089509261478'),
(61, 'KEMAS AFIF MUHAMMAD AL-BAQIR', '2018-07-10 00:00:00.000', 19, 116, 'LAKI_LAKI', 19, 22, 'atlet_22_akte_kelahiran_1757750512225.jpg', 'atlet_22_pas_foto_1757750512231.jpg', 'atlet_22_sertifikat_belt_1757750512237.jpg', NULL, 'Jambi', 'Jambi', 7, 'Jln. HMO Bafaddhal kampung manggis', 'kuning', '1571081007180002', '081272199955'),
(62, 'M. JIBRAN SARFARAZ', '2008-01-07 00:00:00.000', 53.7, 172, 'LAKI_LAKI', 19, 22, 'atlet_22_akte_kelahiran_1757751401503.jpg', 'atlet_22_pas_foto_1757751401511.jpg', 'atlet_22_sertifikat_belt_1757751401517.jpg', 'atlet_22_ktp_04-11-2025_17.49.jpg', 'Jambi', 'Jambi', 17, 'Jln. HMO Bafaddhal kampung manggis', 'kuningHijau', '1571040701080041', '082186731551'),
(63, 'M. KENZIE ALFARIZQI AL HAKIM', '2012-05-25 00:00:00.000', 36.5, 150, 'LAKI_LAKI', 19, 22, 'atlet_22_akte_kelahiran_1757751638051.jpg', 'atlet_22_pas_foto_1757751638056.jpg', 'atlet_22_sertifikat_belt_1757751638059.jpg', NULL, 'Jambi', 'Jambi', 13, 'Jl. Brigjen Katamso Lrg Sukajaya kasang jambi timur', 'kuningHijau', '1571032505120023', '085266899489'),
(64, 'RATU AULIANA', '2013-12-12 00:00:00.000', 36.2, 139, 'PEREMPUAN', 19, 22, 'atlet_22_akte_kelahiran_1757751930034.jpg', 'atlet_22_pas_foto_1757751930042.jpg', 'atlet_22_sertifikat_belt_1757751930047.jpg', NULL, 'Jambi', 'Jambi', 11, 'Rt. 35 kel. Legok', 'kuningHijau', '1571015212130001', '0895342710254'),
(65, 'MONICA BELVANIA PUTRI SALSABILA', '2014-06-27 00:00:00.000', 28.5, 131, 'PEREMPUAN', 19, 22, 'atlet_22_akte_kelahiran_1757752208271.jpg', 'atlet_22_pas_foto_1757752208275.jpg', 'atlet_22_sertifikat_belt_1757752208279.jpg', NULL, 'Jambi', 'Jambi', 11, 'Jln. Pangeran hidayat lorong siswa', 'kuning', '1603156706140002', '085282772828'),
(66, 'AIDAN ALIF DENIANTO', '2013-12-16 00:00:00.000', 32, 143, 'LAKI_LAKI', 19, 22, 'atlet_22_akte_kelahiran_1757752476377.jpg', 'atlet_22_pas_foto_1757752476383.jpg', 'atlet_22_sertifikat_belt_1757752476387.jpg', NULL, 'Jambi', 'Jambi', 11, 'Jln. HMO. Bafadhal Rt.19 Kel. Sungai Asam Kec. Pasar', 'kuning', '1571041612130001', '082269296376'),
(67, 'MSY. YUNITA LIANTI PUTRI', '2008-06-18 00:00:00.000', 60, 158, 'PEREMPUAN', 19, 22, 'atlet_22_akte_kelahiran_1757753264227.pdf', 'atlet_22_pas_foto_1757753264228.jpg', 'atlet_22_sertifikat_belt_1757753264229.pdf', 'atlet_22_ktp_04-11-2025_15.37.jpg', 'Jambi', 'Jambi', 17, 'Jln. GADJAH MADA RT. 54 KEL. JELUTING KEC. JELETUNG', 'kuningHijau', '1571085806080002', '087878222720'),
(68, 'ELLIYANI', '2008-03-28 00:00:00.000', 41, 149, 'PEREMPUAN', 19, 22, 'atlet_22_akte_kelahiran_1757753676827.jpg', 'atlet_22_pas_foto_1757753676831.jpg', 'atlet_22_sertifikat_belt_1757753676835.jpg', 'atlet_22_ktp_04-11-2025_17.59.jpg', 'Jambi', 'Jambi', 17, 'Jln. Raden Patah RT.04 Kel Sijinjang', 'kuningHijau', '1571036803080041', '082280494167'),
(69, 'ADIB PRATAMA WIJAYA', '2010-06-24 00:00:00.000', 72.5, 162, 'LAKI_LAKI', 19, 22, 'atlet_22_akte_kelahiran_1757753989391.jpg', 'atlet_22_pas_foto_1757753989397.jpg', 'atlet_22_sertifikat_belt_1757753989403.jpg', NULL, 'Jambi', 'Jambi', 15, 'Jln. Adityawarman No. 43. Rt.06 Kel. The Hok', 'kuningHijau', '1571022406100001', '081366972808'),
(70, 'Azzura Berliano', '2007-04-20 00:00:00.000', 79, 178, 'LAKI_LAKI', 18, 21, 'atlet_21_akte_kelahiran_1757813540270.jpg', 'atlet_21_pas_foto_1757813540274.jpg', 'atlet_21_sertifikat_belt_1757813540274.jpg', 'atlet_21_ktp_1758368859323.jpg', 'Palembang', 'Sumatera Selatan', 18, 'Jl. HTI Perum GBS Blok. I-17 Desa. Muara Lawai,Muara Enim', 'hitam2', '1603022004070003', '082186290611'),
(71, 'MUHAMMAD AL FAQIH PRABOWO', '2018-12-08 00:00:00.000', 35, 118, 'LAKI_LAKI', 19, 22, 'atlet_22_akte_kelahiran_27-10-2025_20.01.jpg', 'atlet_22_pas_foto_27-10-2025_20.01.jpg', 'atlet_22_sertifikat_belt_1757828245470.jpg', NULL, 'Jambi', 'Jambi', 7, 'JL. ADITYAWARMAN RT 06 NO 21 KEL THE HOK KEC JAMBI SELATAN', 'putih', '1571090812180002', '082375414434'),
(72, 'DAFFA WIRA PRATAMA', '2010-06-09 00:00:00.000', 45, 159, 'LAKI_LAKI', 19, 22, 'atlet_22_akte_kelahiran_1757828811358.jpg', 'atlet_22_pas_foto_1757828811364.jpg', 'atlet_22_sertifikat_belt_1757828811368.jpg', NULL, 'Jambi', 'Jambi', 15, 'PERUM. KOTA BARU INDAH RT 39 A24', 'kuningHijau', '1571070906100081', '082280692442'),
(73, 'OKTAVILIA VERANI', '2010-07-12 00:00:00.000', 43, 153, 'PEREMPUAN', 19, 22, 'atlet_22_akte_kelahiran_04-11-2025_17.36.jpg', 'atlet_22_pas_foto_04-11-2025_17.36.jpg', 'atlet_22_sertifikat_belt_04-11-2025_17.36.jpg', NULL, 'Jambi', 'Jambi', 15, 'JLN. POKAT RT 10 KEL BERINGIN KEC PASAR', 'kuningHijau', '1571045207100001', '082269296376'),
(74, 'PRINCESS RUTH ANGELLE EDELWEIS', '2011-06-16 00:00:00.000', 44, 159, 'PEREMPUAN', 19, 22, 'atlet_22_akte_kelahiran_04-11-2025_17.39.jpg', 'atlet_22_pas_foto_04-11-2025_17.39.jpg', 'atlet_22_sertifikat_belt_04-11-2025_17.39.jpg', NULL, 'Jambi', 'Jambi', 14, 'JL. A. THALIB NO 105 PEMATANG SULUR TELANAIPURA', 'kuningHijau', '1571015606110001', '082269867953'),
(75, 'M.DEFRIADHO DWI PRASETYA', '2011-12-09 00:00:00.000', 45, 162, 'LAKI_LAKI', 19, 22, 'atlet_22_akte_kelahiran_04-11-2025_17.10.jpg', 'atlet_22_pas_foto_04-11-2025_17.10.jpg', 'atlet_22_sertifikat_belt_04-11-2025_17.10.jpg', NULL, 'Jambi', 'Jambi', 14, 'PERUM COFFEE RESIDENCE KEC. KOTA BARU', 'kuningHijau', '1571030912110021', '085281821133'),
(76, 'KEISHA FAIHA ZAKTA', '2009-03-29 00:00:00.000', 45.7, 152, 'PEREMPUAN', 19, 22, 'atlet_22_akte_kelahiran_04-11-2025_17.23.jpg', 'atlet_22_pas_foto_04-11-2025_17.23.jpg', 'atlet_22_sertifikat_belt_04-11-2025_17.23.jpg', NULL, 'Jambi', 'Jambi', 16, 'JLN. SUNAN GUNUNG JATI KOMP. PERUM BUKIT MAYANG ASRI NO. 46 BLOK C 13 KENALI ASAM KOTA BARU', 'kuningHijau', '1571086903090021', '085266831949'),
(77, 'FITRI YANI SIREGAR', '2008-03-31 00:00:00.000', 67.1, 154, 'PEREMPUAN', 19, 22, 'atlet_22_akte_kelahiran_04-11-2025_17.06.jpg', 'atlet_22_pas_foto_04-11-2025_17.06.jpg', 'atlet_22_sertifikat_belt_04-11-2025_17.06.jpg', 'atlet_22_ktp_04-11-2025_18.28.jpg', 'Jambi', 'Jambi', 17, 'JLN. BUNGO TANJUNG DESA MEKAR JAYA JERAMBAH BOLONG', 'kuningHijau', '1509125204080001', '085123202022'),
(78, 'KALILA NILAM CAHYANI', '2009-07-29 00:00:00.000', 55, 164, 'PEREMPUAN', 19, 22, 'atlet_22_akte_kelahiran_04-11-2025_17.16.jpg', 'atlet_22_pas_foto_04-11-2025_17.16.jpg', 'atlet_22_sertifikat_belt_04-11-2025_17.16.jpg', NULL, 'Jambi', 'Jambi', 16, 'JLN. RB. SIAGIAN RT 21 NO 203 KEC. JAMBI SELATAN', 'kuningHijau', '1571026907090003', '089530330770'),
(79, 'MEISYAHRANI CN', '2010-05-20 00:00:00.000', 47, 143, 'PEREMPUAN', 19, 22, 'atlet_22_akte_kelahiran_04-11-2025_17.28.jpg', 'atlet_22_pas_foto_04-11-2025_17.28.jpg', 'atlet_22_sertifikat_belt_04-11-2025_17.28.jpg', NULL, 'Jambi', 'Jambi', 15, 'JL. GUNUNG KIDUL KEL. TALANG BANJAR', 'kuningHijau', '1505066005100004', '081385705377'),
(80, 'NOVALIA AYU AGUSTIN', '2009-08-18 00:00:00.000', 45.5, 152, 'PEREMPUAN', 19, 22, NULL, NULL, NULL, NULL, 'Jambi', 'Jambi', 16, 'JL. DR. SUMBIONO RT 12 JELUTUNG', 'kuning', '3214145608090002', '089529112152'),
(81, 'NUR AZIZAH AZZAHRA', '2009-07-23 00:00:00.000', 46, 156, 'PEREMPUAN', 19, 22, 'atlet_22_akte_kelahiran_04-11-2025_17.34.jpg', 'atlet_22_pas_foto_04-11-2025_17.34.jpg', NULL, NULL, 'Jambi', 'Jambi', 16, 'JL. BUPER PERUM PURI MASURAI 6 TANGKIT', 'putih', '1505086307090003', '082378922321'),
(82, 'ASYIFA MAULIDINA', '2009-03-10 00:00:00.000', 44, 159, 'PEREMPUAN', 19, 22, 'atlet_22_akte_kelahiran_04-11-2025_16.50.jpg', 'atlet_22_pas_foto_04-11-2025_16.50.jpg', 'atlet_22_sertifikat_belt_04-11-2025_16.50.jpg', NULL, 'Jambi', 'Jambi', 16, 'Perum laksana permai 2', 'kuningHijau', '1571035003090004', '082287404024'),
(83, 'ANINDITA KEISHA ZAHRIANSYAH', '2016-10-05 00:00:00.000', 26, 118, 'PEREMPUAN', 19, 22, 'atlet_22_akte_kelahiran_04-11-2025_16.45.jpg', 'atlet_22_pas_foto_04-11-2025_16.47.jpg', 'atlet_22_sertifikat_belt_04-11-2025_16.45.jpg', NULL, 'Jambi', 'Jambi', 9, 'Puri mayang cluster casablanca blok k-19', 'kuning', '1571024510160002', '085266882003'),
(84, 'FAZILA ADZKIA ZAKTA', '2014-10-13 00:00:00.000', 30, 138, 'PEREMPUAN', 19, 22, 'atlet_22_akte_kelahiran_04-11-2025_17.04.jpg', 'atlet_22_pas_foto_04-11-2025_17.04.jpg', 'atlet_22_sertifikat_belt_04-11-2025_17.04.jpg', NULL, 'Jambi', 'Jambi', 11, 'Komp perum bukitmayang asri', 'kuningHijau', '1571075310140003', '082269296376'),
(85, 'MUHAMAD ICHSAN PRADIVTA ATTAURIQ', '2016-03-31 00:00:00.000', 23.6, 128, 'LAKI_LAKI', 19, 22, 'atlet_22_akte_kelahiran_04-11-2025_17.32.jpg', 'atlet_22_pas_foto_04-11-2025_17.32.jpg', 'atlet_22_sertifikat_belt_04-11-2025_17.32.jpg', NULL, 'Jambi', 'Jambi', 9, 'PERUM. COFFEE RESIDENCE KEC. KOTA BARU', 'kuningHijau', '1571033103160001', '085281821113'),
(86, 'DZAKIR KHAFADI', '2015-03-26 00:00:00.000', 44, 134, 'LAKI_LAKI', 19, 22, 'atlet_22_akte_kelahiran_04-11-2025_16.58.jpg', 'atlet_22_pas_foto_04-11-2025_16.58.jpg', 'atlet_22_sertifikat_belt_04-11-2025_16.58.jpg', NULL, 'Jambi', 'Jambi', 10, 'JL. JAMBI SUAK KANDIS KM.07 DESA PUDAK', 'kuningHijau', '1505062603150001', '085266941449'),
(87, 'KHALFANI RAFIF AZKA', '2015-02-05 00:00:00.000', 34.6, 135, 'LAKI_LAKI', 19, 22, 'atlet_22_akte_kelahiran_04-11-2025_17.26.jpg', 'atlet_22_pas_foto_04-11-2025_17.26.jpg', NULL, NULL, 'Jambi', 'Jambi', 10, 'PERUM. CITRA NUSA BLOK I 22', 'kuningHijau', '1571080502150001', '081366611917'),
(88, 'FAIZ ZAFRAN HASIBUAN', '2014-12-12 00:00:00.000', 50.1, 141, 'LAKI_LAKI', 19, 22, 'atlet_22_akte_kelahiran_04-11-2025_17.00.jpg', 'atlet_22_pas_foto_04-11-2025_17.00.jpg', 'atlet_22_sertifikat_belt_04-11-2025_17.00.jpg', NULL, 'Jambi', 'Jambi', 11, 'Jl. Sri S. Prabuwono RT 33 Tj. Pinang', 'kuningHijau', '1571031212140001', '082176969221'),
(89, 'ATHAFARIZ DERIANSYAH AZIZ', '2018-10-10 00:00:00.000', 19, 108, 'LAKI_LAKI', 19, 22, 'atlet_22_akte_kelahiran_04-11-2025_16.56.jpg', 'atlet_22_pas_foto_04-11-2025_16.56.jpg', 'atlet_22_sertifikat_belt_04-11-2025_16.56.jpg', NULL, 'Jambi', 'Jambi', 7, 'Puri mayang cluster casablanca blok k-19', 'kuning', '1571021011180003', '085266882003'),
(90, 'LINDRA RAIDA SYAKHIRA', '2014-08-18 00:00:00.000', 28.2, 133, 'PEREMPUAN', 19, 22, 'atlet_22_akte_kelahiran_04-11-2025_17.30.jpg', 'atlet_22_pas_foto_04-11-2025_17.30.jpg', 'atlet_22_sertifikat_belt_04-11-2025_17.30.jpg', NULL, 'Jambi', 'Jambi', 11, 'ASRAMA KOMPI C', 'kuningHijau', '1571015808140001', '081399327233'),
(91, 'NIRWASITA ZAHWA RAMADHANI', '2012-08-18 00:00:00.000', 65, 160, 'PEREMPUAN', 21, 25, 'atlet_25_akte_kelahiran_09-11-2025_17.45.png', 'atlet_25_pas_foto_09-11-2025_17.45.jpg', 'atlet_25_sertifikat_belt_09-11-2025_17.45.jpg', NULL, 'Bandar Lampung', 'Lampung', 13, NULL, 'biruMerah', '1871035808120001', NULL),
(92, 'Ralisa dara mahatidana', '2006-06-08 00:00:00.000', 57, 158, 'PEREMPUAN', 21, 25, 'atlet_25_akte_kelahiran_09-11-2025_17.47.jpg', 'atlet_25_pas_foto_09-11-2025_17.47.jpg', 'atlet_25_sertifikat_belt_09-11-2025_17.47.jpg', NULL, 'Bandar Lampung', 'Lampung', 19, NULL, 'biruMerah', '1812014806050003', NULL),
(93, 'Adzkiya Nasywa Azzahra', '2006-06-26 00:00:00.000', 46, 155, 'PEREMPUAN', 21, 25, NULL, 'atlet_25_pas_foto_09-11-2025_16.45.jpg', 'atlet_25_sertifikat_belt_09-11-2025_16.45.jpg', 'atlet_25_ktp_09-11-2025_16.45.jpg', 'Bandar Lampung', 'Lampung', 19, NULL, 'kuning', '1810056606060003', NULL),
(94, 'Syafira Syafna', '2004-07-28 00:00:00.000', 44, 146, 'PEREMPUAN', 21, 25, NULL, 'atlet_25_pas_foto_09-11-2025_18.03.png', 'atlet_25_sertifikat_belt_09-11-2025_18.03.jpg', 'atlet_25_ktp_09-11-2025_18.03.jpg', 'Bandar Lampung', 'Lampung', 21, NULL, 'biruMerah', '1804166807040000', NULL),
(95, 'Cahaya Rizki Dwi Agista', '2004-08-08 00:00:00.000', 48, 158, 'PEREMPUAN', 21, 25, 'atlet_25_akte_kelahiran_09-11-2025_16.56.jpg', 'atlet_25_pas_foto_09-11-2025_16.56.jpeg', 'atlet_25_sertifikat_belt_09-11-2025_16.56.png', NULL, 'Bandar Lampung', 'Lampung', 21, NULL, 'kuning', '1805114808040001', NULL),
(96, 'Muhammad Wisha Ramadhan', '2004-10-23 00:00:00.000', 75, 165, 'LAKI_LAKI', 21, 25, NULL, 'atlet_25_pas_foto_09-11-2025_17.33.png', NULL, 'atlet_25_ktp_09-11-2025_17.33.png', 'Bandar Lampung', 'Lampung', 21, NULL, 'putih', '1803102310040001', NULL),
(97, 'Siti Fadilah Sopiah', '2004-08-12 00:00:00.000', 62, 163, 'PEREMPUAN', 21, 25, NULL, 'atlet_25_pas_foto_09-11-2025_18.00.png', 'atlet_25_sertifikat_belt_09-11-2025_18.00.png', 'atlet_25_ktp_09-11-2025_18.00.png', 'Bandar Lampung', 'Lampung', 21, NULL, 'kuningHijau', '1801224812040001', NULL),
(98, 'Amalia Nur Shabrina', '2006-01-02 00:00:00.000', 45, 156, 'PEREMPUAN', 21, 25, 'atlet_25_akte_kelahiran_09-11-2025_17.29.jpg', 'atlet_25_pas_foto_09-11-2025_17.29.jpg', NULL, 'atlet_25_ktp_10-11-2025_14.25.jpg', 'Bandar Lampung', 'Lampung', 19, NULL, 'kuning', '1871084301060003', NULL),
(99, 'RENATA ARYA PUTRA', '2009-04-20 00:00:00.000', 58, 166, 'LAKI_LAKI', 21, 25, 'atlet_25_akte_kelahiran_09-11-2025_17.49.png', 'atlet_25_pas_foto_09-11-2025_17.49.png', 'atlet_25_sertifikat_belt_09-11-2025_17.49.png', NULL, 'Bandar Lampung', 'Lampung', 16, NULL, 'kuning', '1871022004090001', NULL),
(100, 'Fani Rahmanda putri', '2005-04-25 00:00:00.000', 57, 150, 'PEREMPUAN', 21, 25, 'atlet_25_akte_kelahiran_09-11-2025_17.14.jpeg', 'atlet_25_pas_foto_09-11-2025_17.14.jpeg', 'atlet_25_sertifikat_belt_09-11-2025_17.14.jpeg', NULL, 'Bandar Lampung', 'Lampung', 20, NULL, 'kuning', '1812076504050002', NULL),
(101, 'Naina Fatma Azzahra Raudoh', '2006-01-03 00:00:00.000', 60, 156, 'PEREMPUAN', 21, 25, NULL, 'atlet_25_pas_foto_09-11-2025_17.41.png', 'atlet_25_sertifikat_belt_09-11-2025_17.41.jpg', 'atlet_25_ktp_09-11-2025_17.41.png', 'Bandar Lampung', 'Lampung', 19, NULL, 'kuning', '1801094301060003', NULL),
(102, 'seema masheika', '2013-07-17 00:00:00.000', 40, 152, 'PEREMPUAN', 21, 25, 'atlet_25_akte_kelahiran_09-11-2025_17.57.jpg', 'atlet_25_pas_foto_09-11-2025_17.57.png', 'atlet_25_sertifikat_belt_09-11-2025_17.57.jpg', 'atlet_25_ktp_10-11-2025_14.29.jpg', 'Bandar Lampung', 'Lampung', 12, NULL, 'hijauBiru', '1871035707130001', NULL),
(103, 'Maya Sarmida', '2005-06-30 00:00:00.000', 45, 156, 'PEREMPUAN', 21, 25, NULL, 'atlet_25_pas_foto_09-11-2025_17.31.jpeg', 'atlet_25_sertifikat_belt_09-11-2025_17.31.png', 'atlet_25_ktp_09-11-2025_17.31.png', 'Bandar Lampung', 'Lampung', 20, NULL, 'kuning', '1808127007050001', NULL),
(104, 'Deka Riski Melyana', '2005-12-16 00:00:00.000', 65, 160, 'PEREMPUAN', 21, 25, NULL, 'atlet_25_pas_foto_09-11-2025_16.59.jpg', NULL, 'atlet_25_ktp_09-11-2025_16.59.png', 'Bandar Lampung', 'Lampung', 20, NULL, 'putih', '1803175612050001', NULL),
(105, 'Mutia Rahmania', '2007-07-27 00:00:00.000', 50, 159, 'PEREMPUAN', 21, 25, 'atlet_25_akte_kelahiran_09-11-2025_17.35.jpg', 'atlet_25_pas_foto_09-11-2025_17.35.png', 'atlet_25_sertifikat_belt_09-11-2025_17.35.jpg', NULL, 'Bandar Lampung', 'Lampung', 18, NULL, 'kuningHijau', '1871026707090003', NULL),
(106, 'Feza Izzuha Syaima', '2005-09-02 00:00:00.000', 47, 150, 'PEREMPUAN', 21, 25, 'atlet_25_akte_kelahiran_09-11-2025_17.18.png', 'atlet_25_pas_foto_09-11-2025_17.18.png', NULL, NULL, 'Bandar Lampung', 'Lampung', 20, NULL, 'kuning', '1871074209050001', NULL),
(107, 'Muhammad Adli Raffadinata', '2014-12-04 00:00:00.000', 45, 144, 'LAKI_LAKI', 10, 11, 'atlet_11_akte_kelahiran_1757912165369.jpeg', 'atlet_11_pas_foto_1757912165370.jpeg', 'atlet_11_sertifikat_belt_1757912165370.pdf', 'atlet_11_ktp_1758263849761.jpeg', 'Jambi', 'Jambi', 11, 'Jln. Multatuli, Lrg. Harapan Tani II', 'kuningHijau', '1571010412140001', '081274402222'),
(108, 'Muhammad Zaidan Arkana Ramadhan', '2012-08-14 00:00:00.000', 57, 162, 'LAKI_LAKI', 10, 11, 'atlet_11_akte_kelahiran_1757912703874.jpg', 'atlet_11_pas_foto_1757912703876.jpg', 'atlet_11_sertifikat_belt_1757912703877.pdf', 'atlet_11_ktp_1758261725332.jpg', 'Jambi', 'Jambi', 13, 'Jln. Gatot Subroto, No. 38', 'kuning', '1503031408120001', '082185927949'),
(109, 'Mecca Azizah Prillia', '2017-04-04 00:00:00.000', 20, 122, 'PEREMPUAN', 18, 21, 'atlet_21_akte_kelahiran_1757988585253.jpg', 'atlet_21_pas_foto_1757988585258.jpeg', 'atlet_21_sertifikat_belt_1757988585258.jpg', 'atlet_21_ktp_1757988585260.jpg', 'Muara Enim', 'Sumatera Selatan', 8, 'Jl. HTI Perum GBS Blok I-17, Desa Muara Lawai', 'kuningHijau', '1603024404170001', '081279932909'),
(110, 'Adib Hanafi Septriansyah', '2016-09-15 00:00:00.000', 23.2, 127, 'LAKI_LAKI', 18, 21, 'atlet_21_akte_kelahiran_1757989424280.jpg', 'atlet_21_pas_foto_1757989424287.jpg', 'atlet_21_sertifikat_belt_1757989424288.jpg', 'atlet_21_ktp_1757989424294.jpg', 'Muara Enim', 'Sumatera Selatan', 9, 'Jl. Sultan Mahmud Badaruddin 2', 'kuning', '1603021509160002', NULL),
(111, 'Dhiyauddin el zacky', '2006-05-09 00:00:00.000', 68, 168, 'LAKI_LAKI', 21, 25, 'atlet_25_akte_kelahiran_09-11-2025_17.01.jpg', 'atlet_25_pas_foto_09-11-2025_17.01.jpg', NULL, 'atlet_25_ktp_09-11-2025_17.01.jpg', 'Bandar Lampung', 'Lampung', 19, NULL, 'hijau', '1871110905060002', NULL),
(112, 'Lintang Shafira Khatulistiwa', '2012-11-07 00:00:00.000', 52, 156, 'PEREMPUAN', 21, 25, 'atlet_25_akte_kelahiran_09-11-2025_17.21.png', 'atlet_25_pas_foto_09-11-2025_17.21.png', 'atlet_25_sertifikat_belt_09-11-2025_17.21.png', NULL, 'Bandar Lampung', 'Lampung', 13, NULL, 'biru', '1871034711120003', NULL),
(113, 'FARIZ SIDIQ HIDAYAT MUFTI', '2013-06-21 00:00:00.000', 58, 150, 'LAKI_LAKI', 21, 25, 'atlet_25_akte_kelahiran_09-11-2025_17.16.jpg', 'atlet_25_pas_foto_09-11-2025_17.16.png', 'atlet_25_sertifikat_belt_09-11-2025_17.16.jpg', NULL, 'Bandar Lampung', 'Lampung', 12, NULL, 'biru', '1871132106130001', NULL),
(114, 'M.TAUFIK APRILIO', '2009-04-27 00:00:00.000', 62, 170, 'LAKI_LAKI', 21, 25, 'atlet_25_akte_kelahiran_09-11-2025_17.23.jpg', 'atlet_25_pas_foto_09-11-2025_17.23.png', 'atlet_25_sertifikat_belt_09-11-2025_17.23.jpg', NULL, 'Bandar Lampung', 'Lampung', 16, NULL, 'biruMerah', '1871022704090002', NULL),
(115, 'Ahmad Daniel', '2015-12-17 00:00:00.000', 34.2, 132, 'LAKI_LAKI', 18, 21, 'atlet_21_akte_kelahiran_1757994788124.jpg', 'atlet_21_pas_foto_1757994788125.jpg', 'atlet_21_sertifikat_belt_1757994788125.jpg', 'atlet_21_ktp_1757994788126.jpg', 'Muara Enim', 'Sumatera Selatan', 9, 'Jl. H. Pangeran Danal', 'hijau', '1603021712150001', '081272426513'),
(116, 'Al Fajar Rozak Anugrah', '2013-11-04 00:00:00.000', 25.8, 135, 'LAKI_LAKI', 18, 21, 'atlet_21_akte_kelahiran_1757995267167.jpg', 'atlet_21_pas_foto_1757995267168.jpg', NULL, 'atlet_21_ktp_1757995267169.jpg', 'Muara Enim', 'Sumatera Selatan', 11, 'Desa Muara Lawai', 'putih', '1603020411130001', '082235751852'),
(117, 'Ananda Geo Nauvendra', '2014-11-17 00:00:00.000', 37.9, 145, 'LAKI_LAKI', 18, 21, 'atlet_21_akte_kelahiran_1757995985444.jpg', 'atlet_21_pas_foto_1757995985445.jpg', NULL, 'atlet_21_ktp_1757995985446.jpg', 'Muara Enim', 'Sumatera Selatan', 10, 'Jl. Perwira No.26', 'putih', '1671021711140004', '082162650808'),
(118, 'Aqila Nindya Zahra', '2013-01-14 00:00:00.000', 42.2, 154, 'PEREMPUAN', 18, 21, 'atlet_21_akte_kelahiran_1757996352897.jpg', 'atlet_21_pas_foto_1757996352897.jpg', NULL, 'atlet_21_ktp_1757996352898.jpg', 'Muara Enim', 'Sumatera Selatan', 12, 'Jl. KH. Ahmad Dahlan', 'putih', '1603025401130001', '081278509380'),
(119, 'Ardhan Adrianne Nathanael', '2015-06-10 00:00:00.000', 27.2, 139, 'LAKI_LAKI', 18, 21, 'atlet_21_akte_kelahiran_1757996694466.jpg', 'atlet_21_pas_foto_1757996694467.jpg', 'atlet_21_sertifikat_belt_1757996694467.jpg', 'atlet_21_ktp_1757996694468.jpg', 'Muara Enim', 'Sumatera Selatan', 10, 'Dusun 1', 'kuning', '1603021006150001', '085156226228'),
(120, 'Arsyila Zalfa Azrina', '2017-03-19 00:00:00.000', 28.6, 129, 'PEREMPUAN', 18, 21, 'atlet_21_akte_kelahiran_1757997153003.jpg', 'atlet_21_pas_foto_1757997153005.jpg', 'atlet_21_sertifikat_belt_1757997153005.jpg', 'atlet_21_ktp_1757997153007.jpg', 'Muara Enim', 'Sumatera Selatan', 8, 'Jl. Pesira Blok L-12 Perum Pelita Sari Residence', 'kuning', '1604235903170001', '082280063002'),
(121, 'Azka Azfar Rabbani', '2017-07-04 00:00:00.000', 19.3, 117, 'LAKI_LAKI', 18, 21, 'atlet_21_akte_kelahiran_1757997481037.jpg', 'atlet_21_pas_foto_1757997481038.jpg', 'atlet_21_sertifikat_belt_1757997481038.jpg', 'atlet_21_ktp_1757997481038.jpg', 'Muara Enim', 'Sumatera Selatan', 8, 'Dusun 3', 'kuning', '1603110407170001', '082176200083'),
(122, 'Bagas Alfreda', '2013-09-01 00:00:00.000', 65, 158, 'LAKI_LAKI', 18, 21, 'atlet_21_akte_kelahiran_1757997861527.jpg', 'atlet_21_pas_foto_1757997861527.jpg', NULL, 'atlet_21_ktp_1757997861527.jpg', 'Muara Enim', 'Sumatera Selatan', 12, 'Jl. Angkatan 66 Perum Bukit Enim Permai Blok C-12', 'putih', '5408040109130001', '085839701335'),
(123, 'Carisa Azzahra Ramadhani', '2015-06-25 00:00:00.000', 35.3, 142, 'PEREMPUAN', 18, 21, 'atlet_21_akte_kelahiran_1757998601674.jpg', 'atlet_21_pas_foto_1757998601674.jpg', 'atlet_21_sertifikat_belt_1757998601674.jpg', 'atlet_21_ktp_1757998601675.jpg', 'Muara Enim', 'Sumatera Selatan', 10, 'Dusun 1', 'putihKuning', '1603026506150001', '085381271700'),
(124, 'Chikatamiya Calter', '2011-06-22 00:00:00.000', 53.8, 155, 'PEREMPUAN', 18, 21, 'atlet_21_akte_kelahiran_1758005573948.jpg', 'atlet_21_pas_foto_1758005573949.jpg', NULL, 'atlet_21_ktp_1758005573949.jpg', 'Muara Enim', 'Sumatera Selatan', 14, 'Jl. Rambang No. 151', 'putih', '1603026206110002', '085268190610'),
(125, 'Farrel Alfarizi Pranandito', '2014-04-23 00:00:00.000', 45.9, 158, 'LAKI_LAKI', 12, 14, 'atlet_14_akte_kelahiran_1758081423562.jpg', 'atlet_14_pas_foto_1758008142857.png', 'atlet_14_sertifikat_belt_1758008142857.jpg', 'atlet_14_ktp_1758008142857.jpeg', 'Bogor', 'Jawa Barat', 11, 'Perumahan taman kenari nusantara, Cluster Sanur 3. No 11', 'kuningHijau', '2222222222222222', '01828857363'),
(126, 'Destry Putri Barokah', '2012-06-07 00:00:00.000', 43.4, 153, 'PEREMPUAN', 18, 21, 'atlet_21_akte_kelahiran_1758031649202.jpg', 'atlet_21_pas_foto_1758031649202.jpg', 'atlet_21_sertifikat_belt_1758031649203.jpg', 'atlet_21_ktp_1758031649203.jpg', 'Muara Enim', 'Sumatera Selatan', 13, 'Desa Lubuk Ampelas', 'hijau', '1603024706120004', '081271578550'),
(127, 'Erlangga Reza Kencana Putra', '2013-08-04 00:00:00.000', 35.3, 150, 'LAKI_LAKI', 18, 21, 'atlet_21_akte_kelahiran_1758034309228.jpg', 'atlet_21_pas_foto_1758034309229.jpg', 'atlet_21_sertifikat_belt_1758034309229.jpg', 'atlet_21_ktp_1758034309230.jpg', 'Muara Enim', 'Sumatera Selatan', 12, 'Jl. Sultan Mahmud Badaruddin 2 Gang Pandega', 'kuningHijau', '1603020408130003', '085124860550'),
(128, 'Alma Rasendrya', '2013-09-06 00:00:00.000', 26.4, 136, 'PEREMPUAN', 18, 21, 'atlet_21_akte_kelahiran_1758035190798.jpg', 'atlet_21_pas_foto_1758035190798.jpg', 'atlet_21_sertifikat_belt_1758035190798.jpg', 'atlet_21_ktp_1758035190798.jpg', 'Muara Enim', 'Sumatera Selatan', 12, 'Desa Tanjung Raman', 'kuningHijau', '1603114609130002', '082282148312'),
(129, 'Fakhri Rifko Pratama', '2009-08-31 00:00:00.000', 54.2, 169, 'LAKI_LAKI', 18, 21, 'atlet_21_akte_kelahiran_1758035600554.jpeg', 'atlet_21_pas_foto_1758035600558.jpg', NULL, 'atlet_21_ktp_1758035600558.jpeg', 'Muara Enim', 'Sumatera Selatan', 16, 'Perum Bukit Permata Hijau Blok B-9', 'putih', '1603023108090001', '085381223686'),
(130, 'Fakhri Yuri Altamis', '2013-02-23 00:00:00.000', 47.7, 158, 'LAKI_LAKI', 18, 21, 'atlet_21_akte_kelahiran_1758035896736.jpg', 'atlet_21_pas_foto_1758035896736.jpg', NULL, 'atlet_21_ktp_1758035896736.jpg', 'Muara Enim', 'Sumatera Selatan', 12, 'Jl. Proklamasi BTN Air Lintang Blok A-1 No 08', 'putih', '1603022302130001', '081367287098'),
(131, 'Faras Adpan Wijaya', '2013-01-23 00:00:00.000', 37.6, 153, 'LAKI_LAKI', 18, 21, 'atlet_21_akte_kelahiran_1758075064758.jpg', 'atlet_21_pas_foto_1758075064759.jpg', 'atlet_21_sertifikat_belt_1758075064759.jpg', 'atlet_21_ktp_1758075064759.jpg', NULL, 'Sumatera Selatan', 12, 'Jl. Kombes Pol Drs. Soebarkah No 162', 'hijau', '1603022301130002', '08380202244'),
(132, 'Frestia Riski Sabrina', '2013-07-16 00:00:00.000', 28.3, 136, 'PEREMPUAN', 18, 21, 'atlet_21_akte_kelahiran_1758075583184.jpg', 'atlet_21_pas_foto_1758075583184.jpg', NULL, 'atlet_21_ktp_1758075583185.jpg', 'Muara Enim', 'Sumatera Selatan', 12, 'Dusun 2', 'putih', '1603115606130001', '085709475376'),
(133, 'Hanna Az Zahirah', '2013-12-01 00:00:00.000', 49.2, 157, 'PEREMPUAN', 18, 21, 'atlet_21_akte_kelahiran_1758076366289.jpg', 'atlet_21_pas_foto_1758076366291.jpg', 'atlet_21_sertifikat_belt_1758076366296.jpg', 'atlet_21_ktp_1758076366297.jpg', 'Muara Enim', 'Sumatera Selatan', 11, 'Dusun 1', 'putihKuning', '1603024112130002', '088274127626'),
(134, 'Jihan Aurel Abraham', '2014-10-08 00:00:00.000', 50.2, 154, 'PEREMPUAN', 18, 21, 'atlet_21_akte_kelahiran_1758077061976.jpg', 'atlet_21_pas_foto_1758077061976.jpg', NULL, 'atlet_21_ktp_1758077061977.jpg', NULL, 'Sumatera Selatan', 10, 'Jl. Tawalib Darusalam', 'putih', '1702184810140001', '082311444097'),
(135, 'Khayyirah Namira Aqilah', '2010-08-26 00:00:00.000', 57.9, 158, 'PEREMPUAN', 18, 21, 'atlet_21_akte_kelahiran_1758077622872.jpg', 'atlet_21_pas_foto_1758077622875.jpg', 'atlet_21_sertifikat_belt_1758077622876.jpg', 'atlet_21_ktp_1758077622879.jpg', 'Muara Enim', 'Sumatera Selatan', 15, 'Dusun 3', 'kuningHijau', '1604106603100001', '082176768001'),
(136, 'Krishna Eka Prasetya', '2012-09-13 00:00:00.000', 52.6, 164, 'LAKI_LAKI', 18, 21, 'atlet_21_akte_kelahiran_1758077952093.jpg', 'atlet_21_pas_foto_1758077952093.jpg', NULL, 'atlet_21_ktp_1758077952094.jpg', NULL, 'Sumatera Selatan', 13, 'Dusun 4 Komp PTPN VII Suli', 'putih', '1603041309120002', '085141118250'),
(137, 'Kyan Nugraha', '2011-09-14 00:00:00.000', 41, 158, 'LAKI_LAKI', 18, 21, 'atlet_21_akte_kelahiran_1758078184765.jpg', 'atlet_21_pas_foto_1758078184766.jpg', 'atlet_21_sertifikat_belt_1758078184768.jpg', 'atlet_21_ktp_1758078184768.jpg', 'Muara Enim', 'Sumatera Selatan', 14, 'Jl. H. Pangeran Danal No. 221', 'hijau', '1603021409110002', '08318589649'),
(138, 'M. Agung Syahreza', '2012-05-14 00:00:00.000', 65, 170, 'LAKI_LAKI', 18, 21, 'atlet_21_akte_kelahiran_1758078451409.jpg', 'atlet_21_pas_foto_1758078451412.jpg', 'atlet_21_sertifikat_belt_1758078451415.jpg', 'atlet_21_ktp_1758078451417.jpg', 'Muara Enim', 'Sumatera Selatan', 13, 'Jl. Raya Sungai Medang', 'putihKuning', '1674031405120001', '082251940372'),
(139, 'M. Akhtar Muzaffar Simangunsong', '2015-12-10 00:00:00.000', 28.7, 136, 'LAKI_LAKI', 18, 21, 'atlet_21_akte_kelahiran_1758078815578.jpg', 'atlet_21_pas_foto_1758078815581.jpg', 'atlet_21_sertifikat_belt_1758078815581.jpg', 'atlet_21_ktp_1758078815584.jpg', 'Muara Enim', 'Sumatera Selatan', 9, 'Jl. Proklamasi No 48A', 'kuningHijau', '1603021012150001', '082177770202'),
(140, 'M. Anugrah Refano', '2014-10-18 00:00:00.000', 33.8, 141, 'LAKI_LAKI', 18, 21, 'atlet_21_akte_kelahiran_1758079090340.jpg', 'atlet_21_pas_foto_1758079090342.png', 'atlet_21_sertifikat_belt_1758079090344.jpg', 'atlet_21_ktp_1758079090344.jpg', 'Muara Enim', 'Sumatera Selatan', 10, 'Jl. Gotong Royong Darussalam', 'putihKuning', '1671101910140002', '081273234828'),
(141, 'M. Devano Al-Ghifari', '2018-09-12 00:00:00.000', 18.4, 117, 'LAKI_LAKI', 18, 21, 'atlet_21_akte_kelahiran_1758079294413.jpg', 'atlet_21_pas_foto_1758079294415.jpg', 'atlet_21_sertifikat_belt_1758079294415.jpg', 'atlet_21_ktp_1758079294418.jpg', 'Muara Enim', 'Sumatera Selatan', 7, 'Jl. Jend. Sudirman', 'putihKuning', '1603021209180001', '082176644166'),
(142, 'M. Fabians Alghazaam', '2015-02-26 00:00:00.000', 26, 136, 'LAKI_LAKI', 18, 21, 'atlet_21_akte_kelahiran_1758079510631.jpg', 'atlet_21_pas_foto_1758079510633.jpg', NULL, 'atlet_21_ktp_1758079510633.jpg', 'Muara Enim', 'Sumatera Selatan', 10, 'Jl. Proklamasi BTN Air Lintang Lrg Dempo No 185', 'putih', '1603022602150003', '085269365356'),
(143, 'M. Fadlan A. Latif Simangunsong', '2013-01-05 00:00:00.000', 45, 148, 'LAKI_LAKI', 18, 21, 'atlet_21_akte_kelahiran_1758079760298.jpg', NULL, 'atlet_21_sertifikat_belt_1758079760300.jpg', 'atlet_21_ktp_1758079760303.jpg', 'Muara Enim', 'Sumatera Selatan', 12, 'Jl. Proklmasi No 48A', 'biru', '1603020501130002', '082177770202'),
(144, 'M. Fahri Saputra', '2013-02-22 00:00:00.000', 72, 155, 'LAKI_LAKI', 18, 21, 'atlet_21_akte_kelahiran_1758080650998.jpg', 'atlet_21_pas_foto_1758080651000.jpg', 'atlet_21_sertifikat_belt_1758080651000.jpg', 'atlet_21_ktp_1758080651000.jpg', 'Muara Enim', 'Sumatera Selatan', 12, 'Jl. Smb 2 No 311', 'kuning', '1603022202130001', '085273223018'),
(145, 'M. Fairel Marquez', '2014-01-24 00:00:00.000', 21.5, 134, 'LAKI_LAKI', 18, 21, 'atlet_21_akte_kelahiran_1758081684307.jpg', 'atlet_21_pas_foto_1758081684310.jpg', 'atlet_21_sertifikat_belt_1758081684310.jpg', 'atlet_21_ktp_1758081684311.jpg', 'Muara Enim', 'Sumatera Selatan', 11, 'Jl. Musi Raya Timur No 451', 'putihKuning', '1671082401140006', '081273294616'),
(146, 'M. Fathan Al Rizqy', '2015-10-31 00:00:00.000', 24, 129, 'LAKI_LAKI', 18, 21, 'atlet_21_akte_kelahiran_1758082001374.jpg', 'atlet_21_pas_foto_1758082001374.jpg', 'atlet_21_sertifikat_belt_1758082001375.jpg', 'atlet_21_ktp_1758082001375.jpg', 'Muara Enim', 'Sumatera Selatan', 9, 'Jl. Mutiara Pelita Sari', 'kuning', '1603023110150002', '081379319752'),
(147, 'M. Luthfi Caisar Putera', '2012-09-21 00:00:00.000', 31.1, 146, 'LAKI_LAKI', 18, 21, 'atlet_21_akte_kelahiran_1758082276221.jpg', 'atlet_21_pas_foto_1758082276225.jpg', NULL, 'atlet_21_ktp_1758082276227.jpg', 'Muara Enim', 'Sumatera Selatan', 12, 'KPR BTN Blok B3 No 10', 'putih', '1603022011180002', '081377672121'),
(148, 'M. Nur Al Khadafi', '2016-02-24 00:00:00.000', 28.7, 132, 'LAKI_LAKI', 18, 21, 'atlet_21_akte_kelahiran_1758082513374.jpg', 'atlet_21_pas_foto_1758082513374.jpg', 'atlet_21_sertifikat_belt_1758082513374.jpg', 'atlet_21_ktp_1758082513375.jpg', 'Muara Enim', 'Sumatera Selatan', 9, 'Jl. Tira Remaja B. Permata Hijau Blok A-12', 'kuning', '1603022402160001', '081241061597'),
(149, 'M. Pandu Alvaro', '2017-09-09 00:00:00.000', 33.7, 133, 'LAKI_LAKI', 18, 21, 'atlet_21_akte_kelahiran_1758082693323.jpg', 'atlet_21_pas_foto_1758082693324.jpg', 'atlet_21_sertifikat_belt_1758082693327.jpg', 'atlet_21_ktp_1758082693328.jpg', 'Muara Enim', 'Sumatera Selatan', 8, 'Jl. Permai Gg. Kopel', 'kuning', '1603020909170004', '081367116364'),
(150, 'M. Rendi Revansyah', '2013-03-16 00:00:00.000', 31.9, 146, 'LAKI_LAKI', 18, 21, 'atlet_21_akte_kelahiran_1758083227961.jpg', 'atlet_21_pas_foto_1758083227963.jpg', 'atlet_21_sertifikat_belt_1758083227963.jpg', 'atlet_21_ktp_1758083227964.jpg', 'Muara Enim', 'Sumatera Selatan', 12, 'Jl. Sriwijaya No 20 Gg. Prajurit', 'putihKuning', '1603021603130001', '082181614673'),
(151, 'M. Yopi Pratama', '2014-02-10 00:00:00.000', 38.4, 147, 'LAKI_LAKI', 18, 21, 'atlet_21_akte_kelahiran_1758084130432.jpg', 'atlet_21_pas_foto_1758084130433.jpg', 'atlet_21_sertifikat_belt_1758084130436.jpg', 'atlet_21_ktp_1758084130436.jpg', 'Muara Enim', 'Sumatera Selatan', 11, 'Dusun 4', 'kuningHijau', '1604101002140001', '083178891083'),
(152, 'Muhammad Adzka Nazurah', '2012-01-06 00:00:00.000', 57.5, 154, 'LAKI_LAKI', 18, 21, 'atlet_21_akte_kelahiran_1758085927309.jpg', 'atlet_21_pas_foto_1758085927312.jpg', 'atlet_21_sertifikat_belt_1758085927312.jpg', 'atlet_21_ktp_1758085927313.jpg', 'Muara Enim', 'Sumatera Selatan', 13, 'Dusun 1', 'putihKuning', '1608010601120001', '083896396832'),
(153, 'Muhammad Alif Wijaya', '2018-02-13 00:00:00.000', 32.1, 123, 'LAKI_LAKI', 18, 21, 'atlet_21_akte_kelahiran_1758086395882.jpg', 'atlet_21_pas_foto_1758086395882.jpg', 'atlet_21_sertifikat_belt_1758086395882.jpg', 'atlet_21_ktp_1758086395883.jpg', 'Muara Enim', 'Sumatera Selatan', 7, 'Perum GBS Blok D-01', 'kuningHijau', '1603021302180002', '082279895114'),
(154, 'Muhammad Athallah Musyaffa', '2016-10-20 00:00:00.000', 35.9, 134, 'LAKI_LAKI', 18, 21, 'atlet_21_akte_kelahiran_1758086690410.jpg', 'atlet_21_pas_foto_1758086690410.jpg', NULL, 'atlet_21_ktp_1758086690411.jpg', 'Muara Enim', 'Sumatera Selatan', 8, 'Jl. Kirab Remaja Gg. Pamungkas', 'putih', '1603022010160005', '085378374863'),
(155, 'ALMEERA MUIZEE', '2011-01-16 00:00:00.000', 50, 159, 'PEREMPUAN', 21, 25, 'atlet_25_akte_kelahiran_09-11-2025_19.55.jpeg', 'atlet_25_pas_foto_09-11-2025_18.17.jpeg', 'atlet_25_sertifikat_belt_09-11-2025_19.55.jpeg', 'atlet_25_ktp_09-11-2025_19.55.jpeg', 'Bandar Lampung', 'Lampung', 14, NULL, 'hijau', '1111111111111111', NULL),
(156, 'tes dummy', '2006-09-19 00:00:00.000', 11, 170, 'LAKI_LAKI', 1, 1, 'atlet_1_akte_kelahiran_1758958079655.png', 'atlet_1_pas_foto_1758958054499.png', 'atlet_1_sertifikat_belt_1758958070815.png', 'atlet_1_ktp_1758959527403.png', 'Lampung Barat', 'Lampung', 19, 'jalan dalam', 'merahHitam1', '2123123123123123', '091231823483'),
(157, 'dummy u-63', '2010-12-12 00:00:00.000', 63, 123, 'LAKI_LAKI', 1, 1, NULL, NULL, NULL, NULL, 'Jakarta Timur', 'DKI Jakarta', 14, 'jalan damai', 'hijau', '4442342343242343', '081231029321'),
(158, 'Inka Adelia Simanjuntak', '2011-10-02 00:00:00.000', 70, 158, 'PEREMPUAN', 25, 28, 'atlet_28_akte_kelahiran_1758104281077.jpeg', 'atlet_28_pas_foto_1758104281082.jpeg', 'atlet_28_sertifikat_belt_1758104281083.jpeg', NULL, 'Jambi', 'Jambi', 13, NULL, 'hijau', '1505014210110002', '081274327096'),
(159, 'Keyla Refila', '2011-11-29 00:00:00.000', 60, 156, 'PEREMPUAN', 25, 28, 'atlet_28_akte_kelahiran_1758105070670.jpeg', 'atlet_28_pas_foto_1758105070670.jpeg', 'atlet_28_sertifikat_belt_1758105070671.pdf', NULL, 'Jambi', 'Jambi', 13, 'Mendalo Darat', 'biru', '1571016511100211', '088388235557'),
(160, 'Muhammad Rifqi Falaha', '2009-04-12 00:00:00.000', 63, 166, 'LAKI_LAKI', 25, 28, 'atlet_28_akte_kelahiran_1758105423776.jpeg', 'atlet_28_pas_foto_1758106716515.jpeg', 'atlet_28_sertifikat_belt_1758105423778.pdf', NULL, 'Jambi', 'Jambi', 16, 'Mendalo Darat', 'merahHitam2', '1571011204090004', '081274672827'),
(161, 'Azkiya Az-Zikra', '2016-07-27 00:00:00.000', 28, 133, 'PEREMPUAN', 25, 28, 'atlet_28_akte_kelahiran_1758105740879.jpeg', 'atlet_28_pas_foto_1758105740880.jpeg', 'atlet_28_sertifikat_belt_1758105740882.pdf', NULL, 'Jambi', 'Jambi', 9, 'Mendalo Darat', 'hijau', '1571016707160002', '085267529200'),
(162, 'Nayla Zavira', '2011-06-01 00:00:00.000', 72, 170, 'PEREMPUAN', 25, 28, 'atlet_28_akte_kelahiran_1758106015274.jpeg', 'atlet_28_pas_foto_1758106015275.jpeg', 'atlet_28_sertifikat_belt_1758106015275.jpeg', NULL, 'Jambi', 'Jambi', 14, NULL, 'kuning', '1505014106110001', '0887781084168'),
(163, 'Zainatul Aynie', '2012-12-02 00:00:00.000', 36, 150, 'PEREMPUAN', 25, 28, 'atlet_28_akte_kelahiran_1758106218333.jpeg', 'atlet_28_pas_foto_1758106218334.jpeg', 'atlet_28_sertifikat_belt_1758112807884.jpeg', NULL, 'Jambi', 'Jambi', 12, NULL, 'hijau', '1571074211120003', '083851982867'),
(164, 'Muhammad Ibnu Mulkan', '2008-03-17 00:00:00.000', 53, 167, 'LAKI_LAKI', 25, 28, NULL, 'atlet_28_pas_foto_1758106589101.jpeg', 'atlet_28_sertifikat_belt_1758106589101.jpeg', 'atlet_28_ktp_1758106687217.jpeg', 'Jambi', 'Jambi', 17, NULL, 'merah', '1571011703080002', '082176630221'),
(165, 'Syarbila Nurafni', '2013-03-08 00:00:00.000', 40, 148, 'PEREMPUAN', 25, 28, 'atlet_28_akte_kelahiran_1758107020458.jpeg', 'atlet_28_pas_foto_1758107020459.jpeg', 'atlet_28_sertifikat_belt_1758107020460.pdf', NULL, 'Jambi', 'Jambi', 12, NULL, 'hijauBiru', '1571074803130003', '085764430003'),
(166, 'Heti Nur Alya Nabila', '2012-06-27 00:00:00.000', 60, 157, 'PEREMPUAN', 25, 28, 'atlet_28_akte_kelahiran_1758107407538.jpeg', 'atlet_28_pas_foto_1758107407545.jpeg', 'atlet_28_sertifikat_belt_1758107407547.jpeg', NULL, 'Jambi', 'Jambi', 13, NULL, 'kuning', '1505046706120001', '085150803994'),
(167, 'M Alghazali', '2012-12-30 00:00:00.000', 30, 145, 'LAKI_LAKI', 25, 28, 'atlet_28_akte_kelahiran_1758107806696.jpeg', 'atlet_28_pas_foto_1758107806696.jpeg', 'atlet_28_sertifikat_belt_1758107806696.jpeg', NULL, 'Jambi', 'Jambi', 12, NULL, 'hijau', '1571083012120002', '082375116872'),
(168, 'Khalfany Azka D', '2012-11-04 00:00:00.000', 44, 145, 'PEREMPUAN', 25, 28, 'atlet_28_akte_kelahiran_1758108077287.png', 'atlet_28_pas_foto_1758108077290.jpeg', 'atlet_28_sertifikat_belt_1758108077290.jpeg', NULL, 'Jambi', 'Jambi', 12, NULL, 'kuningHijau', '1505044411120001', '082257230536'),
(169, 'Belvania Aqila Sanjaya', '2012-12-25 00:00:00.000', 48, 156, 'PEREMPUAN', 25, 28, 'atlet_28_akte_kelahiran_1758108408704.jpeg', 'atlet_28_pas_foto_1758108408704.jpeg', 'atlet_28_sertifikat_belt_1758108408704.jpeg', NULL, 'Jambi', 'Jambi', 12, NULL, 'kuningHijau', '1505046512120001', '083173602088'),
(170, 'Rayandra Pratama', '2012-09-28 00:00:00.000', 37, 149, 'LAKI_LAKI', 25, 28, 'atlet_28_akte_kelahiran_1758108695784.jpeg', 'atlet_28_pas_foto_1758108695785.jpeg', 'atlet_28_sertifikat_belt_1758108695787.pdf', NULL, 'Jambi', 'Jambi', 12, NULL, 'hijau', '1571012809120001', '0895622439313'),
(171, 'Arza Alzahira', '2010-11-06 00:00:00.000', 49, 160, 'PEREMPUAN', 25, 28, 'atlet_28_akte_kelahiran_1758109764564.jpeg', 'atlet_28_pas_foto_1758109764566.jpeg', 'atlet_28_sertifikat_belt_1758112000428.jpeg', NULL, 'Jambi', 'Jambi', 14, NULL, 'hijau', '1506064611100001', '082280345427'),
(172, 'M. Tito El Syahrawy', '2013-04-01 00:00:00.000', 33.8, 150, 'LAKI_LAKI', 18, 21, 'atlet_21_akte_kelahiran_1758109821160.jpg', 'atlet_21_pas_foto_1758109821161.jpg', 'atlet_21_sertifikat_belt_1758109821161.jpg', 'atlet_21_ktp_1758109821162.jpg', 'Muara Enim', 'Sumatera Selatan', 12, 'Jl. Pelawaran 1 Gg. Famili', 'biru', '1603020104130003', '085268937622');
INSERT INTO `tb_atlet` (`id_atlet`, `nama_atlet`, `tanggal_lahir`, `berat_badan`, `tinggi_badan`, `jenis_kelamin`, `id_dojang`, `id_pelatih_pembuat`, `akte_kelahiran`, `pas_foto`, `sertifikat_belt`, `ktp`, `kota`, `provinsi`, `umur`, `alamat`, `belt`, `nik`, `no_telp`) VALUES
(173, 'Triansi Ayu Lianingrum', '2015-07-10 00:00:00.000', 25, 132, 'PEREMPUAN', 25, 28, 'atlet_28_akte_kelahiran_1758110010073.jpeg', 'atlet_28_pas_foto_1758110010078.jpeg', 'atlet_28_sertifikat_belt_1758110010079.jpeg', NULL, 'Jambi', 'Jambi', 10, NULL, 'kuningHijau', '1571015007150001', '089619053490'),
(174, 'ALIYAH ANUGERAH SYAPUTRI', '2009-10-06 00:00:00.000', 41.8, 155, 'PEREMPUAN', 33, 37, 'atlet_37_akte_kelahiran_1758110084698.jpg', 'atlet_37_pas_foto_1758110084698.jpg', 'atlet_37_sertifikat_belt_1758110084698.jpg', 'atlet_37_ktp_1758110084699.jpg', 'Jambi', 'Jambi', 15, 'Jl. Abadi Perum Amanda 5 Blok 07 RT 019', 'hitam1', '1571074611090062', '082281192041'),
(175, 'Tri Suci Adinda', '2012-01-13 00:00:00.000', 37, 154, 'PEREMPUAN', 25, 28, 'atlet_28_akte_kelahiran_1758110209220.jpeg', 'atlet_28_pas_foto_1758110209230.jpeg', 'atlet_28_sertifikat_belt_1758110209231.jpeg', NULL, 'Jambi', 'Jambi', 13, 'Desa sembubuk', 'kuning', '1506065301120003', '083121754529'),
(176, 'M. Zakwan Al Khawarizmi', '2013-07-02 00:00:00.000', 50.4, 158, 'LAKI_LAKI', 18, 21, 'atlet_21_akte_kelahiran_1758110257802.jpg', 'atlet_21_pas_foto_1758110257803.jpg', 'atlet_21_sertifikat_belt_1758110257806.jpg', 'atlet_21_ktp_1758110257806.jpg', 'Muara Enim', 'Sumatera Selatan', 12, 'Perum Sukamaju Asri Blok E3', 'hijau', '1376030207130001', '082181759021'),
(177, 'Annora Calista', '2012-06-14 00:00:00.000', 43, 148, 'PEREMPUAN', 25, 28, 'atlet_28_akte_kelahiran_1758110414173.jpeg', NULL, 'atlet_28_sertifikat_belt_1758110414175.jpeg', NULL, 'Jambi', 'Jambi', 13, 'Pattimura', 'hijau', '1571075406120008', '082185068730'),
(178, 'Muhammad Aka Al-Amin', '2017-06-25 00:00:00.000', 21.2, 131, 'LAKI_LAKI', 18, 21, 'atlet_21_akte_kelahiran_1758110534457.jpg', 'atlet_21_pas_foto_1758110534459.jpg', 'atlet_21_sertifikat_belt_1758110534459.jpg', 'atlet_21_ktp_1758110534460.jpg', 'Muara Enim', 'Sumatera Selatan', 8, 'Desa Muara Lawai', 'hijauBiru', '1604232506170001', '085267009479'),
(179, 'JIBRIL ADILAH SYAPUTRA', '2011-10-19 00:00:00.000', 42.1, 163, 'LAKI_LAKI', 33, 37, 'atlet_37_akte_kelahiran_1758110676953.jpg', 'atlet_37_pas_foto_1758110676955.jpg', 'atlet_37_sertifikat_belt_1758110676955.jpg', 'atlet_37_ktp_1758110676955.jpg', 'Jambi', 'Jambi', 13, 'Jl Abadi perum Amanda 5 Blok B07 RT 019', 'hitam1', '1503031910110001', '082281192041'),
(180, 'Caroline Indriani Setiawan', '2010-10-21 00:00:00.000', 49, 160, 'PEREMPUAN', 25, 28, 'atlet_28_akte_kelahiran_1758110702036.jpeg', 'atlet_28_pas_foto_1758110702040.jpeg', NULL, NULL, 'Jambi', 'Jambi', 14, 'Desa Sembubuk', 'hijauBiru', '1505016110100001', '081276710349'),
(181, 'Muhammad Daffa Arya Sofyan', '2014-05-17 00:00:00.000', 44, 139, 'LAKI_LAKI', 18, 21, 'atlet_21_akte_kelahiran_1758110796532.jpg', 'atlet_21_pas_foto_1758110796536.jpg', NULL, 'atlet_21_ktp_1758110796536.jpg', 'Muara Enim', 'Sumatera Selatan', 11, 'Muara Lawai', 'putih', '1604231705140001', '081289625096'),
(182, 'Ali Akmal Hakim', '2010-11-29 00:00:00.000', 45, 160, 'LAKI_LAKI', 25, 28, 'atlet_28_akte_kelahiran_1758110914169.jpeg', 'atlet_28_pas_foto_1758110914171.jpeg', 'atlet_28_sertifikat_belt_1758110914172.pdf', NULL, 'Jambi', 'Jambi', 14, NULL, 'hijau', '1571022911100082', '083189873191'),
(183, 'ARJUNA HIDAYAH SYAPUTRA', '2013-03-01 00:00:00.000', 30.2, 145, 'LAKI_LAKI', 33, 37, 'atlet_37_akte_kelahiran_1758111014849.jpg', 'atlet_37_pas_foto_1758111014851.jpg', 'atlet_37_sertifikat_belt_1758111014851.jpg', 'atlet_37_ktp_1758111014851.jpg', 'Jambi', 'Jambi', 12, 'Jl Abadi Perum Amanda 5 Blok 07 RT 019', 'merahHitam2', '1571090103130001', '082281192041'),
(184, 'Muhammad Fathaan Arsyad Raziq', '2016-09-09 00:00:00.000', 29, 130, 'LAKI_LAKI', 18, 21, 'atlet_21_akte_kelahiran_1758111093798.jpg', 'atlet_21_pas_foto_1758111093800.jpg', 'atlet_21_sertifikat_belt_1758111093801.jpg', 'atlet_21_ktp_1758111093803.jpg', 'Muara Enim', 'Sumatera Selatan', 9, 'Dusun 3', 'kuningHijau', '1603110909160001', '082176768001'),
(185, 'Kaysha Nadira Azzahra', '2013-12-13 00:00:00.000', 25, 140, 'PEREMPUAN', 25, 28, 'atlet_28_akte_kelahiran_1758111168565.jpeg', 'atlet_28_pas_foto_1758111168567.jpeg', 'atlet_28_sertifikat_belt_1758111168568.pdf', NULL, 'Jambi', 'Jambi', 11, NULL, 'biru', '1571014212130001', '085266456882'),
